823	closed	sipa	In preparation of IPv6 support: prevent double connections to the same node. Not urgent.	https://api.github.com/repos/bitcoin/bitcoin/pulls/823	https://api.github.com/repos/bitcoin/bitcoin/issues/823/comments	2012-02-11T11:39:50Z	2012-02-21T00:43:56Z
818	closed	laanwj	Enable accessible widgets Qt module on win32 (when static linking), so that people with screen readers such as NVDA can make sense of it.	https://api.github.com/repos/bitcoin/bitcoin/pulls/818	https://api.github.com/repos/bitcoin/bitcoin/issues/818/comments	2012-02-10T07:39:00Z	2012-02-10T17:31:22Z
817	closed	TheBlueMatt	This fixes a potential bug where some NATs may replace the nodes interal IP with its external IP in version messages, causing incorrect checksums when version messages begin being checksummed on February 14, 2012.	https://api.github.com/repos/bitcoin/bitcoin/pulls/817	https://api.github.com/repos/bitcoin/bitcoin/issues/817/comments	2012-02-10T05:25:20Z	2012-02-11T23:14:02Z
816	closed	sipa	Februari 15th, the protocol changes and version and verack messages get a checksum. However, some NAT routers change the IP address inside packets payloads, causing the version messages checksum to become invalid. This commit disables the checksum check, so clients behind such routers can continue to connect after februari 15th.	https://api.github.com/repos/bitcoin/bitcoin/pulls/816	https://api.github.com/repos/bitcoin/bitcoin/issues/816/comments	2012-02-10T03:36:44Z	2012-02-25T21:51:43Z
813	closed	dooglus	Fixes bug #794.	https://api.github.com/repos/bitcoin/bitcoin/pulls/813	https://api.github.com/repos/bitcoin/bitcoin/issues/813/comments	2012-02-09T13:28:03Z	2012-02-10T17:04:19Z
808	closed	luke-jr	Can someone confirm the determinism? ab069992eaf3bde0e6580e00b19935c91438f57b657160b93643152511421cd2 gitian-inputs/bitcoin-deps-0.0.2.tbz2	https://api.github.com/repos/bitcoin/bitcoin/pulls/808	https://api.github.com/repos/bitcoin/bitcoin/issues/808/comments	2012-02-07T21:13:52Z	2012-02-27T02:18:28Z
807	closed	TheBlueMatt		https://api.github.com/repos/bitcoin/bitcoin/pulls/807	https://api.github.com/repos/bitcoin/bitcoin/issues/807/comments	2012-02-07T18:47:47Z	2012-02-12T13:52:35Z
806	closed	sipa	Introduce an enum threadId, and use symbolic indices when accessing vnThreadsRunning. Syntactic changes + bugfix	https://api.github.com/repos/bitcoin/bitcoin/pulls/806	https://api.github.com/repos/bitcoin/bitcoin/issues/806/comments	2012-02-07T18:44:21Z	2012-02-17T18:45:25Z
805	closed	luke-jr	This allows for rebuilding Bitcoin without compiling the deps every time. Also includes fix for #802 (libpng security vuln)	https://api.github.com/repos/bitcoin/bitcoin/pulls/805	https://api.github.com/repos/bitcoin/bitcoin/issues/805/comments	2012-02-07T16:54:17Z	2012-02-07T17:23:34Z
804	closed	gavinandresen	This is a variation on pull #755 I made the option -bip16, defaults to 1 (true). I also moved the logic for setting the switchover time into init.cpp, and set the current-anticpated-switchover-time to March 1 for main network (left it at Feb 15 for test network). I also changed the SoftSetArg(...bool) methods name; during testing I was getting bitten by C++s annoying habit of converting char* to bool instead of string.	https://api.github.com/repos/bitcoin/bitcoin/pulls/804	https://api.github.com/repos/bitcoin/bitcoin/issues/804/comments	2012-02-06T21:48:29Z	2012-02-07T14:08:48Z
803	closed	gavinandresen	I decided Id typed "./bitcoind --nolisten" enough times to make command-line parsing work the way I think it should. Changes are: + Unit tests for the GetArg() methods + --foo=... is automatically interpreted as -foo=... (so you can use double-dashes if you like for all args) + Boolean arguments can be specified as either -foo (true) or -nofoo (false). + Internally, all boolean args are looked up using the positive form and default value (e.g. GetBoolArg("-dnsseed", true)) + Tweaked the --help text + Default for -irc to bootstrap via IRC channel was changed from true to false	https://api.github.com/repos/bitcoin/bitcoin/pulls/803	https://api.github.com/repos/bitcoin/bitcoin/issues/803/comments	2012-02-06T19:43:40Z	2012-02-07T14:15:49Z
801	closed	tcatm	* fixes issue #742 * new translations: cs_CZ fa fi fr_FR hr pl ro_RO sv tr It would be great if someone could review this patch.	https://api.github.com/repos/bitcoin/bitcoin/pulls/801	https://api.github.com/repos/bitcoin/bitcoin/issues/801/comments	2012-02-05T16:00:57Z	2012-02-06T14:54:15Z
800	closed	laanwj	When a transaction has multiple outputs that go to the wallet, list these as multiple transactions in the UI. This is also applied to generated (coinbase) transactions. Also makes the code shorter and easier to understand. This does need some testing.	https://api.github.com/repos/bitcoin/bitcoin/pulls/800	https://api.github.com/repos/bitcoin/bitcoin/issues/800/comments	2012-02-05T11:05:50Z	2012-02-06T20:09:59Z
799	closed	gmaxwell	Help users avoid insecure configurations a bit by recommending a secure RPC password and increasing the incorrect password delay. This may open up a RPC DOS for users with exposed RPC ports and short passwords. Since users shouldnt have exposed RPC ports OR short passwords, the DOS risk is preferable to the compromise risk. Also logs the client IP address for incorrect attempts. With this patch running bitcoind when there is no configuration file now results in: [gmaxwell@helmholtz src]$ ./bitcoind Error: To use bitcoind, you must set a rpcpassword in the configuration file: /home/gmaxwell/.bitcoin/bitcoin.conf It is recommended you use the following random password: rpcuser=bitcoinrpc rpcpassword=HXt6c9zmw6jqW4jvh3pcHTGb7owrmNLUtaSVGvoT2Sho (you do not need to remember this password) If the file does not exist, create it with owner-readable-only file permissions. Previously it just advised rpcpassword= which probably gets filled in with insecure normal password like values. I think ideally bitcoin would just autocreate the file with a random authentication string like this but I thought this change was more minimal. Thoughts?	https://api.github.com/repos/bitcoin/bitcoin/pulls/799	https://api.github.com/repos/bitcoin/bitcoin/issues/799/comments	2012-02-05T08:07:41Z	2012-02-06T20:16:09Z
798	closed	gmaxwell	Help users avoid insecure configurations a bit by recommending a secure RPC password and increasing the incorrect password delay. This may open up a RPC DOS for users with exposed RPC ports and short passwords. Since users shouldnt have exposed RPC ports OR short passwords, the DOS risk is preferable to the compromise risk. Also logs the client IP address for incorrect attempts. With this patch running bitcoind when there is no configuration file now results in: [gmaxwell@helmholtz src]$ ./bitcoind Error: To use bitcoind, you must set a rpcpassword in the configuration file: /home/gmaxwell/.bitcoin/bitcoin.conf It is recommended you use the following random password: rpcuser=bitcoinrpc rpcpassword=HXt6c9zmw6jqW4jvh3pcHTGb7owrmNLUtaSVGvoT2Sho (you do not need to remember this password) If the file does not exist, create it with owner-readable-only file permissions. Previously it just advised rpcpassword=<password> which probably gets filled in with insecure normal password like values. I think ideally bitcoin would just autocreate the file with a random authentication string like this but I thought this change was more minimal. Thoughts?	https://api.github.com/repos/bitcoin/bitcoin/pulls/798	https://api.github.com/repos/bitcoin/bitcoin/issues/798/comments	2012-02-05T07:47:35Z	2012-02-05T08:05:33Z
795	closed	Matoking	The "Minimize to the tray instead of the taskbar" option in Options should now work correctly.	https://api.github.com/repos/bitcoin/bitcoin/pulls/795	https://api.github.com/repos/bitcoin/bitcoin/issues/795/comments	2012-02-03T18:14:42Z	2012-02-12T09:50:09Z
792	closed	gmaxwell	This also avoids flushing setAddrKnown until 24 hours has passed, and avoids contacting the external IP services when not listening. Advertising non-listening nodes is just addr message spam. It doesnt help the network, in fact it hurts the network, and it also hurts users privacy. Advertising far out of sync nodes doesnt help the network they cant even forward (most) transactions and wastes nodes outbound slots.	https://api.github.com/repos/bitcoin/bitcoin/pulls/792	https://api.github.com/repos/bitcoin/bitcoin/issues/792/comments	2012-02-01T23:23:17Z	2012-02-03T21:21:12Z
790	closed	TheBlueMatt	Needs tested by someone who has a UPnP router.	https://api.github.com/repos/bitcoin/bitcoin/pulls/790	https://api.github.com/repos/bitcoin/bitcoin/issues/790/comments	2012-01-31T22:43:39Z	2012-02-01T18:28:18Z
787	closed	sipa	Design goals: * Only keep a limited number of addresses around, so that addr.dat does not grow without bound. * Keep the address tables in-memory, and occasionally write the table to addr.dat. * Make sure no (localized) attacker can fill the entire table with his nodes/addresses. See comments in addrman.h for more detailed information.	https://api.github.com/repos/bitcoin/bitcoin/pulls/787	https://api.github.com/repos/bitcoin/bitcoin/issues/787/comments	2012-01-27T04:16:49Z	2012-03-22T14:45:51Z
786	closed	sipa	See #782: is right in saying that not everything is checked, as GetPubKey() returns the public key embedded in the PrivKey structure, and does not force recalculation. CKey::IsValid() performs this check now.	https://api.github.com/repos/bitcoin/bitcoin/pulls/786	https://api.github.com/repos/bitcoin/bitcoin/issues/786/comments	2012-01-26T18:29:30Z	2012-01-31T17:25:35Z
782	closed	sipa	Reported by onlineproof on IRC: Bitcoin does not verify whether private keys and public keys correspond, when loading a wallet.	https://api.github.com/repos/bitcoin/bitcoin/pulls/782	https://api.github.com/repos/bitcoin/bitcoin/issues/782/comments	2012-01-25T02:06:28Z	2012-01-25T13:43:44Z
780	closed	luke-jr	Please do not close until merged or BIP 17 is Rejected.	https://api.github.com/repos/bitcoin/bitcoin/pulls/780	https://api.github.com/repos/bitcoin/bitcoin/issues/780/comments	2012-01-24T01:58:38Z	2012-02-03T22:27:04Z
778	closed	gavinandresen	Use GetPubKey() instead of GetKey() when looking up public keys by in-the-wallet-bitcoin-address, so addmultisigaddress works correctly with encrypted, locked wallets.	https://api.github.com/repos/bitcoin/bitcoin/pulls/778	https://api.github.com/repos/bitcoin/bitcoin/issues/778/comments	2012-01-23T17:06:09Z	2012-01-23T17:16:53Z
777	closed	luke-jr		https://api.github.com/repos/bitcoin/bitcoin/pulls/777	https://api.github.com/repos/bitcoin/bitcoin/issues/777/comments	2012-01-23T16:38:55Z	2012-01-23T21:00:15Z
775	closed	TheBlueMatt	Wrote this while I was testing CBlockStore, thought I might as well pull request it so that others can use it to test whatever.	https://api.github.com/repos/bitcoin/bitcoin/pulls/775	https://api.github.com/repos/bitcoin/bitcoin/issues/775/comments	2012-01-21T21:17:29Z	2012-01-23T18:18:05Z
774	closed	luke-jr	Correct comment for why the check is unnecessary for coinbases Move testnet check out, to AcceptToMemoryPool where everything else checks it	https://api.github.com/repos/bitcoin/bitcoin/pulls/774	https://api.github.com/repos/bitcoin/bitcoin/issues/774/comments	2012-01-21T01:59:42Z	2012-01-23T18:15:04Z
773	closed	gavinandresen	This also removes an un-needed sigops-per-byte check when accepting transactions to the memory pool (un-needed assuming only standard transactions are being accepted). And it only counts P2SH sigops after the switchover date.	https://api.github.com/repos/bitcoin/bitcoin/pulls/773	https://api.github.com/repos/bitcoin/bitcoin/issues/773/comments	2012-01-20T22:20:24Z	2012-01-25T13:21:21Z
771	closed	TheBlueMatt	From the commitmsg: "Change Bitcoins flow to use a CBlockStore class which net/wallets send/recieve blocks to/from. This commit is designed to not change any bitcoin functionality or operation. Largest changes: * ProcessMessage(s)/SendMessages moved to protocol.cpp * Many globals removed from main.h and abstracted to CBlockStore * Calls to CWallet::AddToWalletIfInvolvingMe no longer block Block verification, resulting in a small, but measureable block verification speed increase. There is still a lot of abstraction to go, but this is a step in the right direction." **This commit is not intended to be merged for 0.6, its targeted for for 0.7.** I just wanted to post it to start getting eyeballs on it as early as possible. ~~In addition, there is a nasty performance bug somewhere that is causing an almost 25% slowdown in block download when downloading a lot of blocks (when downloading from a local tmpfs node to another local tmpfs node, but it is often quicker for smaller sets, say < 5000 blocks). Ive looked at it in valgrind and gprofile and tried changing some possible culprits and havent had any luck tracking it down. _If anyone tracks it down, Ill owe you big time._~~ **Additionally, please mind the removal of cs_main around stuff thats not in main.cpp (esp rpc) and tell me Im wrong to do that.**	https://api.github.com/repos/bitcoin/bitcoin/pulls/771	https://api.github.com/repos/bitcoin/bitcoin/issues/771/comments	2012-01-19T22:59:59Z	2012-05-29T14:51:18Z
770	closed	p2k	* My patch for miniupnpc has made it into the latest MacPorts release: * Documentation has been changed appropriately * New pure-Python macdeployqt; leverages all problems with the stock macdeployqt Additional note: All has been tested and works for me.	https://api.github.com/repos/bitcoin/bitcoin/pulls/770	https://api.github.com/repos/bitcoin/bitcoin/issues/770/comments	2012-01-19T20:48:35Z	2012-02-06T15:35:26Z
769	closed	gavinandresen	This tightens up the IsStandard() rules so transactions that put extra data in their scriptSigs are considered non-standard.	https://api.github.com/repos/bitcoin/bitcoin/pulls/769	https://api.github.com/repos/bitcoin/bitcoin/issues/769/comments	2012-01-19T18:51:43Z	2012-02-07T14:08:47Z
768	closed	nanotube		https://api.github.com/repos/bitcoin/bitcoin/pulls/768	https://api.github.com/repos/bitcoin/bitcoin/issues/768/comments	2012-01-19T06:55:40Z	2012-01-19T19:29:30Z
766	closed	TheBlueMatt	...nfo" This reverts commit 340f0876eabcabefa77588585f7c8f29954dcb48. The data provided by that commit are useless and there is no reason to make the code that much worse by adding yet more globals in a poorly-written way for that info.	https://api.github.com/repos/bitcoin/bitcoin/pulls/766	https://api.github.com/repos/bitcoin/bitcoin/issues/766/comments	2012-01-18T19:59:36Z	2012-02-18T07:36:22Z
765	closed	gavinandresen	All previous versions of bitcoin could store some types of invalid transactions in the orphan-transaction list.	https://api.github.com/repos/bitcoin/bitcoin/pulls/765	https://api.github.com/repos/bitcoin/bitcoin/issues/765/comments	2012-01-18T18:50:55Z	2012-01-23T17:59:02Z
764	closed	luke-jr		https://api.github.com/repos/bitcoin/bitcoin/pulls/764	https://api.github.com/repos/bitcoin/bitcoin/issues/764/comments	2012-01-18T02:50:55Z	2012-01-23T17:59:39Z
762	closed	laanwj	- Revert to global progress indication (see #753) - fix the Qt GUI build (port IP validation in options to network refactoring)	https://api.github.com/repos/bitcoin/bitcoin/pulls/762	https://api.github.com/repos/bitcoin/bitcoin/issues/762/comments	2012-01-17T08:29:18Z	2012-01-17T08:35:16Z
759	closed	forrestv	Adds coinbaseflags, mintime, and curtime to output of getmemorypool. Since users of getmemorypool generate coinbase transactions themselves, they need bitcoind to indicate what should be included in the coinbase data. Mintime and curtime are useful for generating work by changing the timestamp. Without them, P2Pool can only increment the timestamp. With the knowledge of the minimum allowable timestamp, work can be generated symmetrically around the current timestamp, reducing future bias. Generation (without using getmemorypool) tested on testnet:	https://api.github.com/repos/bitcoin/bitcoin/pulls/759	https://api.github.com/repos/bitcoin/bitcoin/issues/759/comments	2012-01-15T05:03:56Z	2012-01-19T19:21:53Z
758	closed	Matoking	Nothing special, Clear All now has a tooltip just like the rest of GUI and About dialog now has the correct year.	https://api.github.com/repos/bitcoin/bitcoin/pulls/758	https://api.github.com/repos/bitcoin/bitcoin/issues/758/comments	2012-01-14T20:56:34Z	2012-01-15T16:09:53Z
757	closed	larsr	Sorry if you find this patch ridiculous. Ill contribute something more substantial when I get more comfortable with the whole process.	https://api.github.com/repos/bitcoin/bitcoin/pulls/757	https://api.github.com/repos/bitcoin/bitcoin/issues/757/comments	2012-01-14T11:17:34Z	2012-01-19T19:29:30Z
755	closed	luke-jr	Please dont force people to vote for things they might not want (and shouldnt).	https://api.github.com/repos/bitcoin/bitcoin/pulls/755	https://api.github.com/repos/bitcoin/bitcoin/issues/755/comments	2012-01-13T17:26:40Z	2012-02-17T14:46:53Z
752	closed	luke-jr		https://api.github.com/repos/bitcoin/bitcoin/pulls/752	https://api.github.com/repos/bitcoin/bitcoin/issues/752/comments	2012-01-10T18:25:46Z	2012-01-10T19:51:55Z
750	closed	TheBlueMatt	These should never have been there, bitcoin isnt anonymous without a ton of work that virtually no users will ever be willing and capable of doing.	https://api.github.com/repos/bitcoin/bitcoin/pulls/750	https://api.github.com/repos/bitcoin/bitcoin/issues/750/comments	2012-01-07T18:39:11Z	2012-01-09T15:58:58Z
748	closed	gavinandresen	This implements BIP 16, the replacement for pay-to-script hash. Tested mostly on testnet-in-a-box, but I did spend time today generating transactions on the testnet as a final sanity test: Testnet block 43561 has 3 Pay-to-script-hash transactions and the /P2SH/ string in its coinbase: The next block has a transaction that spends one of them: Ill be producing/testing backports for miners running old software in the next few days.	https://api.github.com/repos/bitcoin/bitcoin/pulls/748	https://api.github.com/repos/bitcoin/bitcoin/issues/748/comments	2012-01-07T00:53:28Z	2012-01-13T15:26:08Z
746	closed	laanwj	Make the edit field in transaction description read-only	https://api.github.com/repos/bitcoin/bitcoin/pulls/746	https://api.github.com/repos/bitcoin/bitcoin/issues/746/comments	2012-01-06T05:58:53Z	2012-01-09T15:59:18Z
743	closed	gavinandresen	This re-implements pull#714, using system() (which does work on Windows) and boost::thread(). Help text is: -blocknotify=&lt;cmd&gt; Execute command when the best block changes (%s in cmd is replaced by block hash) Example usage (this is how I tested): ./bitcoind -blocknotify="./bitcoind getblock %s >> /tmp/blocks.txt"	https://api.github.com/repos/bitcoin/bitcoin/pulls/743	https://api.github.com/repos/bitcoin/bitcoin/issues/743/comments	2012-01-03T20:53:52Z	2012-01-12T14:31:26Z
741	closed	laanwj	Fix "adress" typo in send coins dialog, also update all translations.	https://api.github.com/repos/bitcoin/bitcoin/pulls/741	https://api.github.com/repos/bitcoin/bitcoin/issues/741/comments	2012-01-03T10:58:48Z	2012-01-03T15:54:38Z
740	closed	TheBlueMatt	I hereby certify that I have greped for ever use of CDataStream and find no case where secure_allocator is necessary. Note that this fix increases blockchain download by gmaxwells estimate of some "1000x faster"	https://api.github.com/repos/bitcoin/bitcoin/pulls/740	https://api.github.com/repos/bitcoin/bitcoin/issues/740/comments	2012-01-03T07:58:25Z	2012-01-05T13:37:24Z
738	closed	sipa	Makes three critical blocks for cs_mapAddresses smaller, and moves writing to the database out of them. This should also improve the concurrency of the code. Closes #737	https://api.github.com/repos/bitcoin/bitcoin/pulls/738	https://api.github.com/repos/bitcoin/bitcoin/issues/738/comments	2012-01-02T23:12:39Z	2012-01-03T01:04:09Z
735	closed	sipa	This introduces CNetAddr and CService, respectively wrapping an (IPv6) address and an IP+port combination. This functionality used to be part of CAddress, which also contains network flags and connection attempt information. These extra fields are however not always necessary. These classes, along with logic for creating connections and doing name lookups, are moved to netbase.{h,cpp}, which does not depend on headers.h. Furthermore, CNetAddr is completely IPv6-ready, though IPv6 functionality is not yet enabled for the application itself.	https://api.github.com/repos/bitcoin/bitcoin/pulls/735	https://api.github.com/repos/bitcoin/bitcoin/issues/735/comments	2012-01-02T21:35:14Z	2012-01-07T14:19:47Z
733	closed	coderrr		https://api.github.com/repos/bitcoin/bitcoin/pulls/733	https://api.github.com/repos/bitcoin/bitcoin/issues/733/comments	2012-01-02T07:35:42Z	2012-01-03T15:24:43Z
731	closed	laanwj	Not all txes with "from"/"to" field are necessarily IP txes. Check for valid bitcoin address first, if not available, fall back to those user-specified fields. - Also, prepare for OP_EVAL by calling all transactions without bitcoin address "SendToOther"/"RecvFromOther" (IP txes are so rare they can be put together with funky OP_EVAL scripts)	https://api.github.com/repos/bitcoin/bitcoin/pulls/731	https://api.github.com/repos/bitcoin/bitcoin/issues/731/comments	2011-12-28T10:20:50Z	2012-01-03T17:24:54Z
730	closed	laanwj	See #729	https://api.github.com/repos/bitcoin/bitcoin/pulls/730	https://api.github.com/repos/bitcoin/bitcoin/issues/730/comments	2011-12-27T09:04:17Z	2011-12-27T21:45:58Z
728	closed	TheBlueMatt		https://api.github.com/repos/bitcoin/bitcoin/pulls/728	https://api.github.com/repos/bitcoin/bitcoin/issues/728/comments	2011-12-23T23:45:26Z	2012-01-03T15:22:49Z
727	closed	gavinandresen	This is designed to work nicely with gettransaction and new blockhash/blockindex information returned in listtransactions; it is modified from the getblock that was in my monitorreceived patch. getblockhash &lt;index&gt; Returns hash of block in best-block-chain at &lt;index&gt;. e.g. getblockhash 0 returns 000000000019d6689c085ae165831e934ff763ae46a2a6c172b3f1b60a8ce26f (genesis block hash) getblock &lt;hash&gt; Returns details of a block with given block-hash. e.g. ./bitcoind getblock $(./bitcoind getblockhash 0) returns the genesis block: { "hash" : "000000000019d6689c085ae165831e934ff763ae46a2a6c172b3f1b60a8ce26f", "blockcount" : 0, "version" : 1, "merkleroot" : "4a5e1e4baab89f3a32518a88c31bc87f618f76673e2cc77ab2127b7afdeda33b", "time" : 1231006505, "nonce" : 2083236893, "difficulty" : 1.00000000, "tx" : [ "4a5e1e4baab89f3a32518a88c31bc87f618f76673e2cc77ab2127b7afdeda33b" ], "hashnext" : "00000000839a8e6886ab5951d76f411475428afc90947ee320161bbf18eb6048" }	https://api.github.com/repos/bitcoin/bitcoin/pulls/727	https://api.github.com/repos/bitcoin/bitcoin/issues/727/comments	2011-12-23T21:34:51Z	2012-01-03T17:20:25Z
726	closed	gavinandresen	This moves all of the "if running over Tor" logic to one place (in init.cpp). It also fixes issues where settings made in the GUI (like fUseProxy) and stored in the wallet could not be over-ridden in the bitcoin.conf file or command-line, by moving command-line-flag-setting code to after the wallet has been loaded. That also meant moving the "bind to listen port" to after the wallet was loaded, but that should be OK 99.99% of the time because the lock file is still checked early to protect against accidentally running bitcoin twice.	https://api.github.com/repos/bitcoin/bitcoin/pulls/726	https://api.github.com/repos/bitcoin/bitcoin/issues/726/comments	2011-12-23T19:13:51Z	2012-01-03T15:21:12Z
723	closed	TheBlueMatt		https://api.github.com/repos/bitcoin/bitcoin/pulls/723	https://api.github.com/repos/bitcoin/bitcoin/issues/723/comments	2011-12-23T10:27:22Z	2011-12-23T11:53:31Z
721	closed	luke-jr	This supercedes the first half of pull #556 (the second half was already merged in pull #695), moving the new information (along with other mining-related information) to a new getmininginfo JSON-RPC method (as requested by Gavin). The old information is still in getinfo for compatibility, but is noted as deprecated.	https://api.github.com/repos/bitcoin/bitcoin/pulls/721	https://api.github.com/repos/bitcoin/bitcoin/issues/721/comments	2011-12-21T04:25:22Z	2012-01-13T15:20:15Z
720	closed	luke-jr		https://api.github.com/repos/bitcoin/bitcoin/pulls/720	https://api.github.com/repos/bitcoin/bitcoin/issues/720/comments	2011-12-20T22:00:36Z	2011-12-21T19:34:00Z
719	closed	luke-jr	This enables miners to manipulate their coinbases. Documented on the [wiki](https://en.bitcoin.it/wiki/Coinbaser). At least Eligius (400 GH/s) and Eclipse (235 GH/s) are already using it, and slush (1.3 TH/s) intends to. Accepted by Gavin for merging in the 0.6 window December 02, 2011.	https://api.github.com/repos/bitcoin/bitcoin/pulls/719	https://api.github.com/repos/bitcoin/bitcoin/issues/719/comments	2011-12-20T20:41:43Z	2012-03-25T04:34:29Z
717	closed	TheBlueMatt		https://api.github.com/repos/bitcoin/bitcoin/pulls/717	https://api.github.com/repos/bitcoin/bitcoin/issues/717/comments	2011-12-20T01:00:37Z	2011-12-20T19:42:54Z
716	closed	gavinandresen	Several miscellaneous code cleanups: + Removed all mention of BORLAND_C : we dont (and never have, as far as I know) support that compiler. + All modern C++ compilers support long long for 64-bit integers, so removed the windows #ifdefs + Replaced all occurrences of INT_MAX/etc with the typesafe std::numeric_limits<> methods + Replaced a constant 10,000-byte buffer with a properly ECDSA_sizeed vector (and removed a memcpy)	https://api.github.com/repos/bitcoin/bitcoin/pulls/716	https://api.github.com/repos/bitcoin/bitcoin/issues/716/comments	2011-12-20T00:20:50Z	2011-12-20T16:52:22Z
715	closed	luke-jr	... by sending the correct codebase name of Satoshi and, if PUBLIC_CLIENT_NAME is defined, the front-end name after that	https://api.github.com/repos/bitcoin/bitcoin/pulls/715	https://api.github.com/repos/bitcoin/bitcoin/issues/715/comments	2011-12-19T20:57:01Z	2012-02-03T22:25:35Z
