2444	closed	jonasschnelli	check why/preview: If pull is accepted, windows, etc. icons will follow. - according to official bitcoin logo - no chopped shadow - retina-screen support info: the psd (Adobe Photoshop) file (bitcoin.psd) is for further changes (contains unrendered effects)	https://api.github.com/repos/bitcoin/bitcoin/pulls/2444	https://api.github.com/repos/bitcoin/bitcoin/issues/2444/comments	2013-04-02T11:03:16Z	2013-04-05T08:19:10Z
2443	closed	Diapolo	- use labelExplanation for sending and receiving tab and move the string from the ui-file to the source - ensure that the table holding the label and address is resized so that the address column fits the address and the label column is stretched to fit the window size - rename some stuff for much easier readbility in the code (I find it hard to get the meaning of stuff like labels or buttons)	https://api.github.com/repos/bitcoin/bitcoin/pulls/2443	https://api.github.com/repos/bitcoin/bitcoin/issues/2443/comments	2013-04-02T10:12:53Z	2013-04-05T18:24:06Z
2442	closed	Diapolo	- add missing initalisation for clientModel - remove unneded RPCExecutor::start() code	https://api.github.com/repos/bitcoin/bitcoin/pulls/2442	https://api.github.com/repos/bitcoin/bitcoin/issues/2442/comments	2013-04-02T09:28:02Z	2013-04-05T08:24:15Z
2441	closed	Diapolo	- as QClipboard::Selection isnt available on Windows ensure that the correct mode is called, but sill allow selection for e.g. X11 - start conversion from QCoreApplication::instance() to qApp in guiutil.cpp (I intend to harmonize this all over the source with my Qt5 compatibility pull) Fixes #2438	https://api.github.com/repos/bitcoin/bitcoin/pulls/2441	https://api.github.com/repos/bitcoin/bitcoin/issues/2441/comments	2013-04-02T09:22:47Z	2013-04-02T14:34:35Z
2440	closed	Diapolo	- fix debug window, by re-adding rpcConsole->setClientModel(clientModel); in BitcoinGUI::setClientModel(), which was removed by #2220	https://api.github.com/repos/bitcoin/bitcoin/pulls/2440	https://api.github.com/repos/bitcoin/bitcoin/issues/2440/comments	2013-04-01T13:21:35Z	2013-04-01T14:43:18Z
2437	closed	Diapolo	- the send coins context menu entry was not working anymore, because a non current version of #2220 was merged onto current master - also removes some unneeded spaces and adds a comment to WalletModel::getNumTransactions()	https://api.github.com/repos/bitcoin/bitcoin/pulls/2437	https://api.github.com/repos/bitcoin/bitcoin/issues/2437/comments	2013-04-01T12:47:59Z	2013-04-01T14:44:03Z
2433	closed	laanwj	It was needlessly confusing people, as it doesnt necessarily match the number of transactions in the transaction list. There is discussion and code in #2177 to add this to the debug window. Im not sure about that, but I am sure that it needs to go from the overview page.	https://api.github.com/repos/bitcoin/bitcoin/pulls/2433	https://api.github.com/repos/bitcoin/bitcoin/issues/2433/comments	2013-03-31T08:20:32Z	2013-03-31T08:20:39Z
2432	closed	aviad	Now that bitcoinrpc 0.3 is out (https://pypi.python.org/pypi/bitcoin-python/0.3), I am suggesting versions of the contrib python scripts (wallettools and spendfrom), which are using this new version. IMPORTANT: these will not work with bitcoinrpc V0.2.	https://api.github.com/repos/bitcoin/bitcoin/pulls/2432	https://api.github.com/repos/bitcoin/bitcoin/issues/2432/comments	2013-03-31T07:35:28Z	2013-06-24T14:51:58Z
2431	closed	jgarzik	The internal miner is closely bound to the wallet engine, not the blockchain engine. This small cleanup was cherry-picked from #2154 because it is useful beyond the obvious merits: it gets closer to my goal of fork()ing away the blockchain engine. Note that this commit places GenerateBitcoins() after RPC server start, unlike #2154 which employs a stub thread.	https://api.github.com/repos/bitcoin/bitcoin/pulls/2431	https://api.github.com/repos/bitcoin/bitcoin/issues/2431/comments	2013-03-31T05:58:02Z	2013-04-02T15:56:57Z
2430	closed	Aeyoun	boost::filesystem::create_directory() defaults to allow all users full access to the Bitcoin DataDir. This directory should only be accessible to the owner to limit unauthorized access. A future version can use boost::filesystem::permissions() (v1.49+) instead of dealing with the lower level chmod directly.	https://api.github.com/repos/bitcoin/bitcoin/pulls/2430	https://api.github.com/repos/bitcoin/bitcoin/issues/2430/comments	2013-03-31T01:11:00Z	2013-04-08T15:38:26Z
2428	closed	r000n	Words in English language are more short than in other langs usually. Tabs dont fits in line in Spanish/German/Russian when they has two words. Wallet has limited functionality. It can send & receive coins. So we can safely rename "Send coins" to "Send" and "Receive coins" to "Receive". Address book is just user contacts. This change is affects a translations. Ported from Freicoin	https://api.github.com/repos/bitcoin/bitcoin/pulls/2428	https://api.github.com/repos/bitcoin/bitcoin/issues/2428/comments	2013-03-29T18:50:45Z	2013-04-02T12:41:25Z
2424	closed	laanwj	On non-us keyboards you can obtain lower case characters even pressing the SHIFT, this caused false positives (issue #1855).	https://api.github.com/repos/bitcoin/bitcoin/pulls/2424	https://api.github.com/repos/bitcoin/bitcoin/issues/2424/comments	2013-03-29T09:56:31Z	2013-03-29T09:56:43Z
2423	closed	TheBlueMatt	Based on #2409 (though I dont think it needs it). Just puts a limit on how large mapAlreadyAskedFor can grow.	https://api.github.com/repos/bitcoin/bitcoin/pulls/2423	https://api.github.com/repos/bitcoin/bitcoin/issues/2423/comments	2013-03-29T06:59:19Z	2013-04-04T01:31:36Z
2422	closed	sipa	-dbcache was originally used to set the maximum buffer size in the BDB environment, and was later changed to set the chainstate cache and leveldb caches. No need to use it for BDB now that only the wallet remains there. This should reduce memory allocation (but not necessarily memory usage) a bit, especially when -dbcache is set high.	https://api.github.com/repos/bitcoin/bitcoin/pulls/2422	https://api.github.com/repos/bitcoin/bitcoin/issues/2422/comments	2013-03-29T02:07:34Z	2013-03-31T04:19:10Z
2421	closed	silvioq	This optional parameter is used to specify the block which is used to look up the raw transaction. (https://github.com/bitcoin/bitcoin/issues/2077) ![Pantallazo](https://f.cloud.github.com/assets/155036/316346/a28a2b3c-9812-11e2-81a5-c9f788280e7b.png)	https://api.github.com/repos/bitcoin/bitcoin/pulls/2421	https://api.github.com/repos/bitcoin/bitcoin/issues/2421/comments	2013-03-29T01:48:11Z	2013-06-24T14:54:21Z
2420	closed	sipa	Clean up all known global datastructures at shutdown. This should make leak detection much easier. Typical valgrind output after this: ==5897== definitely lost: 0 bytes in 0 blocks ==5897== indirectly lost: 0 bytes in 0 blocks ==5897== possibly lost: 1,903 bytes in 9 blocks ==5897== still reachable: 194,073 bytes in 2,929 blocks (almost all of the reachable stuff is RPC/asio/boostthreads)	https://api.github.com/repos/bitcoin/bitcoin/pulls/2420	https://api.github.com/repos/bitcoin/bitcoin/issues/2420/comments	2013-03-29T01:21:24Z	2013-04-02T17:00:32Z
2419	closed	sipa	It seems there were two mechanisms for assessing whether a CNode was still in use: a refcount and a release timestamp. The latter seems to have been there for a long time, as a safety mechanism. However, this timer also keeps CNode objects alive for far longer than necessary after disconnects, potentially opening up a DoS window. This commit removes the timestamp-based mechanism, and replaces it with an assert(nRefCount >= 0), to verify that the refcounting is indeed correctly working.	https://api.github.com/repos/bitcoin/bitcoin/pulls/2419	https://api.github.com/repos/bitcoin/bitcoin/issues/2419/comments	2013-03-28T23:58:41Z	2013-04-08T15:21:06Z
2418	closed	sipa	Every block index entry currently requires a separately-allocated CBigNum. By replacing them with uint256, its just 32 bytes extra in CBlockIndex itself. This should save us a few megabytes in RAM (around 32 bytes per block), and less allocation overhead.	https://api.github.com/repos/bitcoin/bitcoin/pulls/2418	https://api.github.com/repos/bitcoin/bitcoin/issues/2418/comments	2013-03-28T23:02:23Z	2013-04-12T17:27:56Z
2415	closed	fredan	Using a publisher socket to publish three things when they are happening in the Bitcoin client: 1) New transactions 2) New blocks 3) New ipaddresses This way there are no need to ask the bitcoin client if something new has happen. You will be notified! To compile: make -f makefile.unix USE_ZMQ=1 To run: bitcoind -zmqpubbind="ipc://.bitcoin.pub" A Python client that will print all the information: [CODE] import zmq def main(): context = zmq.Context() socket = context.socket(zmq.SUB) socket.setsockopt(zmq.SUBSCRIBE, "") socket.connect("ipc://.bitcoin.pub") while True: msg = socket.recv() print "%s" % (msg[8:]) if __name__ == __main__: main() [/CODE] For more commandline options, see bitcoind --help.	https://api.github.com/repos/bitcoin/bitcoin/pulls/2415	https://api.github.com/repos/bitcoin/bitcoin/issues/2415/comments	2013-03-27T20:55:05Z	2013-10-21T01:39:44Z
2414	closed	Diapolo	- Update Boost from 1.50 to 1.53 -- removes the need to build the Chrono lib - Update OpenSSL from 1.0.1c to 1.0.1e -- fixes for CVE-2013-0169, CVE-2012-2686 and CVE-2013-0166 - Update Qt from 4.8.3 to 4.8.4 - Update libqrencode from 3.2.0 to 3.4.2 -- Memory leak bug has been fixed and others Dont merge this yet, this is just to see what pull tester is doing with it :). Replaces #2108	https://api.github.com/repos/bitcoin/bitcoin/pulls/2414	https://api.github.com/repos/bitcoin/bitcoin/issues/2414/comments	2013-03-27T07:16:13Z	2013-06-24T14:57:58Z
2411	closed	TheBlueMatt		https://api.github.com/repos/bitcoin/bitcoin/pulls/2411	https://api.github.com/repos/bitcoin/bitcoin/issues/2411/comments	2013-03-24T23:42:04Z	2013-03-29T15:03:19Z
2410	closed	gmaxwell	In my tests corrupted wallets would often result in BDB dropping an error just due to duplicate records being found, which appears harmless.	https://api.github.com/repos/bitcoin/bitcoin/pulls/2410	https://api.github.com/repos/bitcoin/bitcoin/issues/2410/comments	2013-03-24T20:01:46Z	2013-05-07T15:58:35Z
2409	closed	sipa	This pull request contains: * The commits from #2016 and #2017 * Fixes and memory improvements for those * A change from per-connection to per-message send buffers * A change to break processing of getdata into several stages, when the send buffer fills up This should improve network latency and memory usage.	https://api.github.com/repos/bitcoin/bitcoin/pulls/2409	https://api.github.com/repos/bitcoin/bitcoin/issues/2409/comments	2013-03-24T15:54:24Z	2013-03-31T04:05:23Z
2406	closed	sander-kleykens	Building bitcoin as root can cause /dev/null to be removed on some systems (e.g. FreeBSD 8.3-RELEASE-p3 and gcc version 4.2.2). This pull request fixes the issue. A patch has also been sent upstream, see	https://api.github.com/repos/bitcoin/bitcoin/pulls/2406	https://api.github.com/repos/bitcoin/bitcoin/issues/2406/comments	2013-03-23T16:30:34Z	2013-06-24T14:56:31Z
2403	closed	gmaxwell	Current relay behavior is widely deployed. Supplying a higher minfee than mining and relaying just irritates users without anti-spam gain.	https://api.github.com/repos/bitcoin/bitcoin/pulls/2403	https://api.github.com/repos/bitcoin/bitcoin/issues/2403/comments	2013-03-23T00:49:49Z	2013-04-08T08:50:21Z
2396	closed	Nothing4You		https://api.github.com/repos/bitcoin/bitcoin/pulls/2396	https://api.github.com/repos/bitcoin/bitcoin/issues/2396/comments	2013-03-21T11:21:54Z	2013-03-29T08:39:42Z
2393	closed	r000n	Trivial changes, ported from Freicoin	https://api.github.com/repos/bitcoin/bitcoin/pulls/2393	https://api.github.com/repos/bitcoin/bitcoin/issues/2393/comments	2013-03-20T20:21:28Z	2013-03-29T08:40:33Z
2387	closed	Diapolo	I want to keep us up to date, so another translations update after the recent merges.	https://api.github.com/repos/bitcoin/bitcoin/pulls/2387	https://api.github.com/repos/bitcoin/bitcoin/issues/2387/comments	2013-03-19T22:49:17Z	2013-04-01T14:45:11Z
2386	closed	Diapolo	- this should prevent GUI issues on Mac that were observed before (disappearing GUI - see #1522) - the patch ensures, that createTrayIconMenu() is always called on Mac to process and use our MacDockIconHandler	https://api.github.com/repos/bitcoin/bitcoin/pulls/2386	https://api.github.com/repos/bitcoin/bitcoin/issues/2386/comments	2013-03-19T22:37:16Z	2013-03-31T05:51:43Z
2385	closed	gavinandresen	This gives people running bitcoind a way of getting alerts in a timely manner, instead of needing to poll with "getinfo" and parse the "errors" array. Example usage in a bitcoin.conf: alertnotify=echo %s | mail -s "URGENT: bitcoind alert" admin@service.com The command string is passed to the shell, with %s replaced by the alert message enclosed in single quotes.	https://api.github.com/repos/bitcoin/bitcoin/pulls/2385	https://api.github.com/repos/bitcoin/bitcoin/issues/2385/comments	2013-03-19T18:15:58Z	2013-03-29T14:49:56Z
2384	closed	gmaxwell	Now that the wallet is the only thing in BDB any DB open errors must be from the wallet itself-- so deleting everything else will not likely help.	https://api.github.com/repos/bitcoin/bitcoin/pulls/2384	https://api.github.com/repos/bitcoin/bitcoin/issues/2384/comments	2013-03-19T17:17:03Z	2013-03-19T21:20:22Z
2383	closed	jonls	This patch adds a new "Advanced" pane to the options box where the dust limit for accepted transactions can be set, and where a filter on output addresses can be specified. CTxMemPool::accept() will drop any transaction with outputs below the dust limit, or with an output address corresponding to an address specified in the filter. ![screenshot](https://f.cloud.github.com/assets/420734/273459/ef1212e4-9024-11e2-957a-31f3f8996172.png)	https://api.github.com/repos/bitcoin/bitcoin/pulls/2383	https://api.github.com/repos/bitcoin/bitcoin/issues/2383/comments	2013-03-18T23:41:40Z	2013-04-29T03:00:02Z
2382	closed	Diapolo	IMHO the copyright displayed in the bitcoin-qt.exe properties should be updated to 2013 ;).	https://api.github.com/repos/bitcoin/bitcoin/pulls/2382	https://api.github.com/repos/bitcoin/bitcoin/issues/2382/comments	2013-03-18T23:06:51Z	2013-03-19T16:54:55Z
2378	closed	Diapolo	Ill create a Transifex pull afterwards, perhaps we have a little more time to let the translators catch up before the 0.8.1 release!?	https://api.github.com/repos/bitcoin/bitcoin/pulls/2378	https://api.github.com/repos/bitcoin/bitcoin/issues/2378/comments	2013-03-18T07:30:54Z	2013-03-19T17:01:06Z
2376	closed	Diapolo	IMHO, this is no Linux specific switch.	https://api.github.com/repos/bitcoin/bitcoin/pulls/2376	https://api.github.com/repos/bitcoin/bitcoin/issues/2376/comments	2013-03-17T17:57:13Z	2013-03-19T16:55:50Z
2373	closed	gavinandresen	I intend these three commits, applied on top of the v0.8.0 tag, to be the 0.8.1 release. The plan is: + A new checkblock rule, in effect until 15 May, that ensure only blocks compatible with old releases are accepted into the main chain (only blocks that touch 4,500 or fewer distinct txids are allowed). + A limit of 500k to blocks created, also in effect until 15 May. Alerts will be sent to pre-0.8 releases over the next two months, telling people to either upgrade or create a DB_CONFIG file so they can handle large blocks. After May 15th, blocks up to 1MB large will be allowed again. Tested by syncing the entire main chain and the testnet chains. A unit test is included, but it only runs if you download the 900K forking block (see the comment in src/test/checkblock_tests.cpp ).	https://api.github.com/repos/bitcoin/bitcoin/pulls/2373	https://api.github.com/repos/bitcoin/bitcoin/issues/2373/comments	2013-03-16T20:22:30Z	2013-03-19T21:18:20Z
2366	closed	zechiel	As discussed on the #bitcoin-dev IRC channel, enforcing unique addresses in sendmany is useful because it may prevent the user from accidentally paying somebody twice. If you really want to, it should be possible to include the same address multiple times using the rawtransaction commands, though.	https://api.github.com/repos/bitcoin/bitcoin/pulls/2366	https://api.github.com/repos/bitcoin/bitcoin/issues/2366/comments	2013-03-14T01:48:59Z	2013-04-12T21:06:50Z
2364	closed	Bobalot	More or less copied code from the -blocknotify and -walletnotify, but for all accepted transactions. Is there a good reason not to implement this? As far as i can tell any DOS attack will be limited by the rate limiting of free transactions and even then process spawn limits can be set on any unix system. As long as the script does something simple, such as adding the txid to a queue, then there will be little chance of the number of spawned processess building up. This is very useful to people who would otherwise have to rely on constant polling or centralised services such as blockchain.info websockets.	https://api.github.com/repos/bitcoin/bitcoin/pulls/2364	https://api.github.com/repos/bitcoin/bitcoin/issues/2364/comments	2013-03-13T19:31:08Z	2013-04-12T21:07:28Z
2361	closed	L2G	This just changes the font size of the word "Wallet" from 11 to 13 points.	https://api.github.com/repos/bitcoin/bitcoin/pulls/2361	https://api.github.com/repos/bitcoin/bitcoin/issues/2361/comments	2013-03-13T02:25:43Z	2013-03-31T05:49:09Z
2357	closed	gavinandresen	The shutdown code has bothered me for a long time, with fShutdown and vnThreadsRunning and a bunch of ad-hoc Sleeps(). Reports of shutdown-on-exit bugs in 0.8 prompted me to clean it all up. This pull reworks the way we keep track of threads, using boost::thread_groups or boost::thread pointers. Instead of polling for a global fShutdown flag, threads now just MilliSleep(), wait on boost mutexes, or periodically call boost::this_thread::interruption_point(), and are interrupted using boosts thread interruption mechanisms. All of the cleanup removes 400 lines of code, and, I hope, makes the code easier to follow. Tested on OSX extensively, and compiled/tested lightly on Windows XP.	https://api.github.com/repos/bitcoin/bitcoin/pulls/2357	https://api.github.com/repos/bitcoin/bitcoin/issues/2357/comments	2013-03-11T22:07:00Z	2013-04-04T01:25:00Z
2352	closed	Nerzahd	![unnamed](https://f.cloud.github.com/assets/901234/241234/832f0602-899b-11e2-8c69-21d30ee3dc8f.png)	https://api.github.com/repos/bitcoin/bitcoin/pulls/2352	https://api.github.com/repos/bitcoin/bitcoin/issues/2352/comments	2013-03-10T16:00:02Z	2013-03-11T23:05:49Z
2351	closed	petertodd	Keeps the UTXO set from being bloated by the creation of outputs that will never be spent because doing so would cost more in fees than they are worth. Includes changes to the UI to ensure the user cant create such outputs, as well as the transaction creation code to round off change if the change txout would itself be unspendable.	https://api.github.com/repos/bitcoin/bitcoin/pulls/2351	https://api.github.com/repos/bitcoin/bitcoin/issues/2351/comments	2013-03-10T01:11:07Z	2013-03-10T03:02:36Z
2350	closed	DavidGriffith	Bitcoin-qt has annoyed me and others for some time because the "Copy Address" button only copies to the clipboard that you have to use the cut and paste keystrokes. It does not, until now, copies to the old-fashioned X11 clipboard that you can just select something and paste using the middle button. That complicates doing things like pasting a command line into arbitrary windows (particularly xterm). This very simple change fixes that oversight.	https://api.github.com/repos/bitcoin/bitcoin/pulls/2350	https://api.github.com/repos/bitcoin/bitcoin/issues/2350/comments	2013-03-09T09:01:35Z	2013-03-29T08:45:59Z
2349	closed	dserrano5	Giving negative values to the -par parameter causes bitcoin to run with 1 verification thread. It can be useful to tell bitcoin to use all existing CPUs but leave e.g. 1 of them free for another tasks; this patch allows that by specifying -par=-1.	https://api.github.com/repos/bitcoin/bitcoin/pulls/2349	https://api.github.com/repos/bitcoin/bitcoin/issues/2349/comments	2013-03-08T19:06:11Z	2013-04-29T17:54:04Z
2348	closed	freewil	This is a real simple change to make the comments match the property names of `CRPCCommand` Here is the diff, ignoring the whitespace:	https://api.github.com/repos/bitcoin/bitcoin/pulls/2348	https://api.github.com/repos/bitcoin/bitcoin/issues/2348/comments	2013-03-07T10:19:37Z	2013-03-11T23:07:43Z
2343	closed	cozz		https://api.github.com/repos/bitcoin/bitcoin/pulls/2343	https://api.github.com/repos/bitcoin/bitcoin/issues/2343/comments	2013-03-04T20:25:51Z	2013-11-14T17:49:52Z
2338	closed	TheBlueMatt	This allows full nodes to use bloom filters as an optimization when downloading blocks (dont double-relay txn) as long as we have a sufficiently large mempool.	https://api.github.com/repos/bitcoin/bitcoin/pulls/2338	https://api.github.com/repos/bitcoin/bitcoin/issues/2338/comments	2013-02-25T01:39:34Z	2013-02-26T15:30:37Z
2337	closed	petertodd		https://api.github.com/repos/bitcoin/bitcoin/pulls/2337	https://api.github.com/repos/bitcoin/bitcoin/issues/2337/comments	2013-02-24T22:00:59Z	2013-03-11T23:08:23Z
2336	closed	petertodd	Test every invalid op code, and add an explicit test for Gavins proposed format for provably unspendable/always prunable transactions using the 0xFF invalid opcode. Specifically any scriptPubKey of the following form: 0xFF {zero or more ops} Because the scriptSig and scriptPubKey are processed separately one cant even use IF/ENDIF trickery to defeat this. I also like how it says "INVALID" quite clearly as the first opcode. Ive tried this out on testnet with no issues. Unless anyone has a reason why this standard is a bad idea Im also going to raise the issue with P2Pool; currently they are the main producer of non-prunable txouts that could be made prunable this way. No code to actually do anything with this standard is included in this patch; that can be done later.	https://api.github.com/repos/bitcoin/bitcoin/pulls/2336	https://api.github.com/repos/bitcoin/bitcoin/issues/2336/comments	2013-02-24T21:54:50Z	2013-03-11T23:16:51Z
2335	closed	petertodd	s/linux/unix/	https://api.github.com/repos/bitcoin/bitcoin/pulls/2335	https://api.github.com/repos/bitcoin/bitcoin/issues/2335/comments	2013-02-24T21:03:21Z	2013-03-01T14:11:06Z
2333	closed	Diapolo	- remove code from step 7, which we already have in step 5 of init	https://api.github.com/repos/bitcoin/bitcoin/pulls/2333	https://api.github.com/repos/bitcoin/bitcoin/issues/2333/comments	2013-02-23T22:52:25Z	2013-05-04T10:11:09Z
2332	closed	Diapolo	- harmonize the database related init messages - as we have a thread for importing blocks, that init message is obsolete	https://api.github.com/repos/bitcoin/bitcoin/pulls/2332	https://api.github.com/repos/bitcoin/bitcoin/issues/2332/comments	2013-02-23T22:50:16Z	2013-03-19T16:57:58Z
2331	closed	starius	First translated phrase in this patch, "Double-click to edit address or label" is text of tooltip of table with my addresses.	https://api.github.com/repos/bitcoin/bitcoin/pulls/2331	https://api.github.com/repos/bitcoin/bitcoin/issues/2331/comments	2013-02-23T10:59:28Z	2013-02-23T23:31:41Z
2325	closed	mikehearn		https://api.github.com/repos/bitcoin/bitcoin/pulls/2325	https://api.github.com/repos/bitcoin/bitcoin/issues/2325/comments	2013-02-20T15:36:47Z	2013-02-20T16:57:14Z
2315	closed	sipa	In case any step in the loading of block databases fails, suggest to start a reindex.	https://api.github.com/repos/bitcoin/bitcoin/pulls/2315	https://api.github.com/repos/bitcoin/bitcoin/issues/2315/comments	2013-02-16T18:47:09Z	2013-02-18T22:31:20Z
2314	closed	laanwj	No one is maintaining ready-to-go windows dependencies, and the current ones are ancient, so the current windows build instructions dont make sense. If someone feels like writing complete build instructions including dependencies, please do.	https://api.github.com/repos/bitcoin/bitcoin/pulls/2314	https://api.github.com/repos/bitcoin/bitcoin/issues/2314/comments	2013-02-16T17:58:36Z	2013-02-16T17:59:44Z
2312	closed	gmaxwell	This fixes test_bitcoin failures on openbsd reported by dhill on IRC. On some systems rand() is a simple LCG over 2^31 and so it produces an even-odd sequence. ApproximateBestSubset was only using the least significant bit and so every run of the iterative solver would be the same for some inputs, resulting in some pretty dumb decisions. Using something other than the least significant bit would paper over the issue but who knows what other way a systems rand() might get us here. Instead we use an internal RNG with a period of something like 2^60 which is well behaved. This also makes it possible to make the selection deterministic for the tests, if we wanted to implement that.	https://api.github.com/repos/bitcoin/bitcoin/pulls/2312	https://api.github.com/repos/bitcoin/bitcoin/issues/2312/comments	2013-02-15T23:36:32Z	2013-02-22T16:57:38Z
2311	closed	gavinandresen	Fixes issue#2288. Includes cleanups from Lukes pull 2243. Tested on OSX, Linux, and cross-compiling in gitian. "We" should refactor all of the common makefile code into a makefile.common, and include it from the other makefiles. There is an odd mix of CFLAGS / CXXFLAGS / xCXXFLAGS in our makefiles.	https://api.github.com/repos/bitcoin/bitcoin/pulls/2311	https://api.github.com/repos/bitcoin/bitcoin/issues/2311/comments	2013-02-15T19:30:48Z	2013-02-18T22:31:53Z
2310	closed	sipa	Improvement upon #2294.	https://api.github.com/repos/bitcoin/bitcoin/pulls/2310	https://api.github.com/repos/bitcoin/bitcoin/issues/2310/comments	2013-02-14T21:34:18Z	2013-02-22T16:59:37Z
2309	closed	sipa	Improvement upon #2294.	https://api.github.com/repos/bitcoin/bitcoin/pulls/2309	https://api.github.com/repos/bitcoin/bitcoin/issues/2309/comments	2013-02-14T21:32:54Z	2013-02-14T21:33:47Z
