3258	closed	Diapolo	Dont talk about it, just merge it ^^. NO other change than removal of spaces.	https://api.github.com/repos/bitcoin/bitcoin/pulls/3258	https://api.github.com/repos/bitcoin/bitcoin/issues/3258/comments	2013-11-15T11:26:02Z	2013-11-15T12:58:00Z
3252	closed	laanwj	Adds three new languages: - de_AT: German (Austria) - gl: Galician - sl_SI: Slovenian (Slovenia) Updates many others. Thanks to the translators contributing on Transifex!	https://api.github.com/repos/bitcoin/bitcoin/pulls/3252	https://api.github.com/repos/bitcoin/bitcoin/issues/3252/comments	2013-11-14T14:01:09Z	2013-11-15T07:59:05Z
3251	closed	dertin	spellcheck.	https://api.github.com/repos/bitcoin/bitcoin/pulls/3251	https://api.github.com/repos/bitcoin/bitcoin/issues/3251/comments	2013-11-14T13:40:37Z	2013-11-14T13:53:00Z
3248	closed	laanwj	This is more consistent with other places in the GUI. ![overviewalignright](https://f.cloud.github.com/assets/126646/1539303/35e0bb78-4d06-11e3-8cad-d6eeff582cf8.png)	https://api.github.com/repos/bitcoin/bitcoin/pulls/3248	https://api.github.com/repos/bitcoin/bitcoin/issues/3248/comments	2013-11-14T08:25:21Z	2013-11-15T07:57:24Z
3247	closed	Diapolo	- example: if util.h includes stdint.h, remove it from util.cpp, as util.h is the first header included in util.cpp	https://api.github.com/repos/bitcoin/bitcoin/pulls/3247	https://api.github.com/repos/bitcoin/bitcoin/issues/3247/comments	2013-11-13T16:44:12Z	2013-11-15T07:57:27Z
3246	closed	laanwj	Rebased (and pulltester-fixed) version of #3184	https://api.github.com/repos/bitcoin/bitcoin/pulls/3246	https://api.github.com/repos/bitcoin/bitcoin/issues/3246/comments	2013-11-13T13:55:34Z	2013-11-13T16:23:38Z
3244	closed	laanwj	Change mingw build to use C99 printf statements. Otherwise, format specifiers such as PRId64 will not work on XP or earlier (see This bug was introduced with 51ed9ec9. Continued from #3237 (Silence inttypes.h compiler warnings on Windows) and #3236 (massive compiler warning spam). This also adds strprintf() testcases so that hopefully this problem will be caught by the pulltester next time.	https://api.github.com/repos/bitcoin/bitcoin/pulls/3244	https://api.github.com/repos/bitcoin/bitcoin/issues/3244/comments	2013-11-13T10:37:29Z	2013-11-13T16:58:36Z
3241	closed	laanwj	Fixes ancient issue #1460.	https://api.github.com/repos/bitcoin/bitcoin/pulls/3241	https://api.github.com/repos/bitcoin/bitcoin/issues/3241/comments	2013-11-12T15:42:16Z	2013-11-12T16:21:25Z
3240	closed	laanwj	Rebased version of #2901	https://api.github.com/repos/bitcoin/bitcoin/pulls/3240	https://api.github.com/repos/bitcoin/bitcoin/issues/3240/comments	2013-11-12T12:44:16Z	2013-11-13T12:35:12Z
3238	closed	Diapolo	- harmonize function with GUIUtil::getOpenFileName() - also make PNG Image singular (grammar)	https://api.github.com/repos/bitcoin/bitcoin/pulls/3238	https://api.github.com/repos/bitcoin/bitcoin/issues/3238/comments	2013-11-11T21:59:50Z	2013-11-12T08:37:27Z
3237	closed	Diapolo	- the warnings are related to MinGWs inttypes.h (observed with MinGW based on GCC version 4.8.1 (rev5, Built by MinGW-W64 project) and likely other version also suffer from this) - fixes #3236	https://api.github.com/repos/bitcoin/bitcoin/pulls/3237	https://api.github.com/repos/bitcoin/bitcoin/issues/3237/comments	2013-11-11T21:53:18Z	2013-11-13T10:38:22Z
3235	closed	Diapolo		https://api.github.com/repos/bitcoin/bitcoin/pulls/3235	https://api.github.com/repos/bitcoin/bitcoin/issues/3235/comments	2013-11-11T15:22:01Z	2013-11-12T08:34:16Z
3233	closed	laanwj	Lets merge the non-controversial commits of #3147, at least if it passes the pulltester now.	https://api.github.com/repos/bitcoin/bitcoin/pulls/3233	https://api.github.com/repos/bitcoin/bitcoin/issues/3233/comments	2013-11-11T08:59:11Z	2013-11-11T12:42:25Z
3232	closed	laanwj	Add note about building on Ubuntu 13.10 (issue #3219). Also mention `autoconf` as required package.	https://api.github.com/repos/bitcoin/bitcoin/pulls/3232	https://api.github.com/repos/bitcoin/bitcoin/issues/3232/comments	2013-11-11T08:12:24Z	2013-11-11T08:50:22Z
3231	closed	brandondahler	Updates some documentation, sparked from issue #3230. I cannot test the build instructions myself, but assume they will work (what is there now doesnt work regardless). The command find . -path */.git* -prune -o -type f -exec grep makefile\\. {} \; -print shows only 2 more files that reference the old makefile.* files: cd src; $(MAKE) -f makefile.unix bitcoind cd src; $(MAKE) -f makefile.unix clean cd src; $(MAKE) -f makefile.unix test_bitcoin ./contrib/debian/rules src/makefile.osx (Expat). ./contrib/debian/changelog	https://api.github.com/repos/bitcoin/bitcoin/pulls/3231	https://api.github.com/repos/bitcoin/bitcoin/issues/3231/comments	2013-11-11T03:33:12Z	2013-11-11T08:59:38Z
3223	closed	TheBlueMatt	* Add a few more basic script/tx test-cases (bitcoinj broke :( ) * Skip comparison tool on win32 since Wine breaks it	https://api.github.com/repos/bitcoin/bitcoin/pulls/3223	https://api.github.com/repos/bitcoin/bitcoin/issues/3223/comments	2013-11-08T17:35:47Z	2013-11-08T17:48:30Z
3222	closed	Diapolo	- rework window title to not include Bitcoin - in front, as no other dialog does this - favor a connect() call over an own function for clearing the traffic graph - write monospace lowercase (seems to be correct after some web search) and add a comment that we should avoid / remove fixed font sizes	https://api.github.com/repos/bitcoin/bitcoin/pulls/3222	https://api.github.com/repos/bitcoin/bitcoin/issues/3222/comments	2013-11-08T07:27:37Z	2013-11-08T08:32:43Z
3215	closed	laanwj	This adds a simple "Open URI..." option to the menu which allows manually opening URIs and payment requests from files on disk. ![openurl1](https://f.cloud.github.com/assets/126646/1482933/a436f73c-46ed-11e3-9a17-c05f9d03c62c.png) ![openurl2](https://f.cloud.github.com/assets/126646/1482934/a448fe5a-46ed-11e3-8086-eda85889fec3.png) Some behind-the-scenes code changes: - Always route received URIs (even those drag/dropped) through PaymentServer; this means that bitcoin: URIs that refer to payment requests can be used - Add getOpenFileName function to GUIUtil analogous to getSaveFileName Addresses #3202.	https://api.github.com/repos/bitcoin/bitcoin/pulls/3215	https://api.github.com/repos/bitcoin/bitcoin/issues/3215/comments	2013-11-06T14:17:20Z	2013-11-11T13:33:43Z
3211	closed	brandondahler	Fixes issue #3200. I do not know much about autotools nor automake, I would highly recommend review by a more knowledgeable person in the area. Has been merged into #2767 and subsequenty caused it to pass the BitcoinPullTester.	https://api.github.com/repos/bitcoin/bitcoin/pulls/3211	https://api.github.com/repos/bitcoin/bitcoin/issues/3211/comments	2013-11-06T03:07:54Z	2013-11-09T17:47:00Z
3209	closed	Diapolo	Could you check the ``AskPassphraseDialog::event()`` code, it looks like we nearly duplicated ``AskPassphraseDialog::eventFilter()``. Perhaps its save to remove it, Im not sure.	https://api.github.com/repos/bitcoin/bitcoin/pulls/3209	https://api.github.com/repos/bitcoin/bitcoin/issues/3209/comments	2013-11-05T18:21:42Z	2013-11-07T12:53:34Z
3208	closed	Diapolo	- this change extends our working drag and drop feature for bitcoin: URIs by adding support for payment request URIs (payment request files should be easy to do in another pull also) - removes code from BitcoinGUI and lets PaymentServer handle it - makes eventFilter() in PaymentServer protected Intended as a first step for #3202.	https://api.github.com/repos/bitcoin/bitcoin/pulls/3208	https://api.github.com/repos/bitcoin/bitcoin/issues/3208/comments	2013-11-05T18:11:37Z	2013-11-08T07:04:58Z
3206	closed	Diapolo		https://api.github.com/repos/bitcoin/bitcoin/pulls/3206	https://api.github.com/repos/bitcoin/bitcoin/issues/3206/comments	2013-11-05T16:38:00Z	2013-11-05T17:02:52Z
3205	closed	Diapolo		https://api.github.com/repos/bitcoin/bitcoin/pulls/3205	https://api.github.com/repos/bitcoin/bitcoin/issues/3205/comments	2013-11-05T16:29:49Z	2013-11-05T17:02:13Z
3204	closed	Diapolo		https://api.github.com/repos/bitcoin/bitcoin/pulls/3204	https://api.github.com/repos/bitcoin/bitcoin/issues/3204/comments	2013-11-05T16:21:40Z	2013-11-05T18:24:40Z
3199	closed	sipa	This pull request should have no functional effects. * The first commit removes the CBlockIndex dependency of CCoinsView, making it reason in terms of block hashes (which it was doing under the hood anyway). * The second commit moves most CCoins/CCoinsView related logic to coins.{h,cpp}, and the rest to txmempool.{h,cpp}. This removes the need for the LookupFromTip loophole, as txmempool is just built on top of coins.	https://api.github.com/repos/bitcoin/bitcoin/pulls/3199	https://api.github.com/repos/bitcoin/bitcoin/issues/3199/comments	2013-11-05T01:59:25Z	2013-11-11T02:09:58Z
3198	closed	nvmd	This is supposed to fix #2806 (compilation problems on OSX 10.9: ``` ... CXX rpcdump.o In file included from rpcdump.cpp:5: In file included from /Applications/Xcode.app/Contents/Developer/Toolchains/XcodeDefault.xctoolchain/usr/bin/../lib/c++/v1/iostream:38: In file included from /Applications/Xcode.app/Contents/Developer/Toolchains/XcodeDefault.xctoolchain/usr/bin/../lib/c++/v1/ios:216: /Applications/Xcode.app/Contents/Developer/Toolchains/XcodeDefault.xctoolchain/usr/bin/../lib/c++/v1/__locale:144:29: error: cannot initialize a parameter of type std::__1::locale::facet * with an lvalue of type const boost::date_time::time_input_facet<boost::posix_time::ptime, char, std::__1::istreambuf_iterator<char, std::__1::char_traits<char> > > * __install_ctor(__other, __f, __f ? __f->id.__get() : 0); ^~~ rpcdump.cpp:31:23: note: in instantiation of function template specialization std::__1::locale::locale<const boost::date_time::time_input_facet<boost::posix_time::ptime, char, std::__1::istreambuf_iterator<char, std::__1::char_traits<char> > > > requested here const std::locale loc(std::locale::classic(), &facet); ^ /Applications/Xcode.app/Contents/Developer/Toolchains/XcodeDefault.xctoolchain/usr/bin/../lib/c++/v1/__locale:96:46: note: passing argument to parameter here void __install_ctor(const locale&, facet*, long); ^ 1 error generated. make[3]: *** [rpcdump.o] Error 1 make[2]: *** [all-recursive] Error 1 make[1]: *** [all] Error 2 make: *** [all-recursive] Error 1 ```)	https://api.github.com/repos/bitcoin/bitcoin/pulls/3198	https://api.github.com/repos/bitcoin/bitcoin/issues/3198/comments	2013-11-04T21:04:02Z	2013-11-05T00:50:55Z
3197	closed	laanwj	Closes #839	https://api.github.com/repos/bitcoin/bitcoin/pulls/3197	https://api.github.com/repos/bitcoin/bitcoin/issues/3197/comments	2013-11-04T15:32:36Z	2013-11-05T00:00:50Z
3196	closed	laanwj	No more specific handling of GUI in bitcoin core. Replace the last usage of fHaveGUI with a fForceServer parameter on AppInit2.	https://api.github.com/repos/bitcoin/bitcoin/pulls/3196	https://api.github.com/repos/bitcoin/bitcoin/issues/3196/comments	2013-11-04T13:39:38Z	2013-11-05T12:06:08Z
3193	closed	joshtriplett	Unless a .gitignore pattern is anchored, itll match in any directory, not juts at the top level. Simplify .gitignore accordingly.	https://api.github.com/repos/bitcoin/bitcoin/pulls/3193	https://api.github.com/repos/bitcoin/bitcoin/issues/3193/comments	2013-11-02T15:31:32Z	2013-11-03T02:36:42Z
3192	closed	sarchar	This check is unnecessary since the size of a transaction is no less than 60. It also seems a little inconsistent since MAX_BLOCK_SIZE is used for both length of the serialized block and for the number of transactions in a block. If there are MAX_BLOCK_SIZE transactions, the serialized size check will fail.	https://api.github.com/repos/bitcoin/bitcoin/pulls/3192	https://api.github.com/repos/bitcoin/bitcoin/issues/3192/comments	2013-11-01T20:23:48Z	2013-11-11T05:17:26Z
3191	closed	wtogami	sha256sum verification of source tarballs during gitian build. This follows the earlier example in boost-win32.yml. This does not change anything about the gitian outputs. **Test Plan** * Search for multiple copies of the tarball and download them from multiple distros. Confirm that they match the sha256sums in this commit.	https://api.github.com/repos/bitcoin/bitcoin/pulls/3191	https://api.github.com/repos/bitcoin/bitcoin/issues/3191/comments	2013-11-01T04:00:03Z	2013-11-07T12:03:35Z
3189	closed	Diapolo	- add new processSendCoinsReturn() function, which parses the status of WalletModel::SendCoinsReturn and generates a pair consisting of a message and message flags - result is we only need one emit message() call - this change ensures that the GUI is shown for warnings/errors in sendcoinsdialog, because of message() taking care of that for modal messages - changes 2 warning message into error messages and removed "Error:" in front of the actual error message string	https://api.github.com/repos/bitcoin/bitcoin/pulls/3189	https://api.github.com/repos/bitcoin/bitcoin/issues/3189/comments	2013-10-30T14:40:45Z	2013-10-31T07:17:29Z
3188	closed	Diapolo	Its IMHO much easier to work with debug.log, if timestamps are shown, which I think also mentioned some days ago.	https://api.github.com/repos/bitcoin/bitcoin/pulls/3188	https://api.github.com/repos/bitcoin/bitcoin/issues/3188/comments	2013-10-30T10:38:15Z	2013-11-04T14:18:23Z
3187	closed	Diapolo	- remove explicit init of netManager as this is done in the constructor anyway - move initNetManager() call to uiReady(), which removes an assert() and allows us to use message() in initNetManager() (currently unused but could be necessary because of proxy related messages) - make initNetManager() private - update paymentservertests.cpp	https://api.github.com/repos/bitcoin/bitcoin/pulls/3187	https://api.github.com/repos/bitcoin/bitcoin/issues/3187/comments	2013-10-30T10:34:17Z	2013-11-11T15:00:34Z
3185	closed	gavinandresen	Send "reject" messages to peers if their transactions or blocks are rejected. See and the discussion on the bitcoin-development mailing list. Tested by running three -regtest -debug=net -printtoconsole nodes, one of which was running with -fuzzmessagestest=11 to generate garbled blocks/transactions, and verified that reject messages were sent and reported correctly as new blocks were generated and transactions sent between them.	https://api.github.com/repos/bitcoin/bitcoin/pulls/3185	https://api.github.com/repos/bitcoin/bitcoin/issues/3185/comments	2013-10-30T07:50:20Z	2013-11-11T01:11:39Z
3184	closed	sje1	Some expanded docs for the rpc commands...comments? terrible? Based on the proposal, update the help message of rpc methods - strings arguments are in double quotes rather than square brackets - numeric arguments have no quotes (and no default value) - optional parameters are surrounded by round brackets - json arguments are strings but dont use double quotes Added 3 sections for the details - Arguments: lists each argument, its type, required or not, a default, and a description - Result: The method result, with json format if applicable, type, and a description - Examples: examples calls using bitcoin-cli and curl for json rpc call Problems - maybe this is too verbose - lines might be too long - description are not good or complete - examples may be too much	https://api.github.com/repos/bitcoin/bitcoin/pulls/3184	https://api.github.com/repos/bitcoin/bitcoin/issues/3184/comments	2013-10-29T11:58:12Z	2013-11-13T13:55:49Z
3180	closed	pstratem	Currently there is a 100ms sleep in the message processing thread that adds delay to processing messages. This patch skips the sleep when there is additional work to do. Additionally ProcessMessages & ProcessGetData are modified such that their maximum run time is reduced; this improves the average latency peers see when there is high load. (This has a significant impact on high latency networks during initial block synchronization).	https://api.github.com/repos/bitcoin/bitcoin/pulls/3180	https://api.github.com/repos/bitcoin/bitcoin/issues/3180/comments	2013-10-28T23:40:34Z	2013-11-04T05:52:25Z
3179	closed	Diapolo	- it can happen, that PaymentServer::ipcSendCommandLine() is unable to detect the correct network, for example when a bitcoin: URI contains an invalid address or when a payment request can be read - in this case try to send the request to a mainnet local pr server, if this fails use a testnet local pr server	https://api.github.com/repos/bitcoin/bitcoin/pulls/3179	https://api.github.com/repos/bitcoin/bitcoin/issues/3179/comments	2013-10-28T16:48:46Z	2013-10-30T15:04:52Z
3177	closed	Diapolo	- replaces pwalletMain->IsLocked() checks, which mostly did not even throw an error - in keypoolrefill init kpSize to 0 as we have the logic to determine max kpSize in pwalletMain->TopUpKeyPool() anyway	https://api.github.com/repos/bitcoin/bitcoin/pulls/3177	https://api.github.com/repos/bitcoin/bitcoin/issues/3177/comments	2013-10-28T11:01:26Z	2013-10-28T12:01:40Z
3176	closed	Diapolo	- add a check for CKey::size() of a and b (size can be 0 or 32) - change the fixed value in memcmp() to use a.size() instead - fixes #3090	https://api.github.com/repos/bitcoin/bitcoin/pulls/3176	https://api.github.com/repos/bitcoin/bitcoin/issues/3176/comments	2013-10-28T10:22:52Z	2013-10-30T08:03:25Z
3175	closed	TheBlueMatt	Dont merge this till pull-tester comes back	https://api.github.com/repos/bitcoin/bitcoin/pulls/3175	https://api.github.com/repos/bitcoin/bitcoin/issues/3175/comments	2013-10-28T07:54:05Z	2013-10-28T08:08:53Z
3174	closed	TheBlueMatt		https://api.github.com/repos/bitcoin/bitcoin/pulls/3174	https://api.github.com/repos/bitcoin/bitcoin/issues/3174/comments	2013-10-28T07:00:28Z	2013-10-28T07:49:03Z
3173	closed	gavinandresen	I needed this to test the new "reject" p2p message, but it should be generally useful for fuzz-testing network message handling code. Note: youll quickly trigger the DoS-and-ban code if you connect to random peers, this is most useful in a two-nodes-on-your-development-machine testnet-in-a-box or -regtest setup.	https://api.github.com/repos/bitcoin/bitcoin/pulls/3173	https://api.github.com/repos/bitcoin/bitcoin/issues/3173/comments	2013-10-28T06:32:45Z	2013-10-30T07:51:25Z
3169	closed	Diapolo	- directly connect to message() signal from wallet model in the main GUI to reduce complexity of the slot/signal handling for message()	https://api.github.com/repos/bitcoin/bitcoin/pulls/3169	https://api.github.com/repos/bitcoin/bitcoin/issues/3169/comments	2013-10-27T20:19:30Z	2013-10-28T06:44:58Z
3165	closed	laanwj		https://api.github.com/repos/bitcoin/bitcoin/pulls/3165	https://api.github.com/repos/bitcoin/bitcoin/issues/3165/comments	2013-10-27T08:12:00Z	2013-10-27T08:12:04Z
3164	closed	TheBlueMatt	One minor tweak to make the block downloading a bit more aggressively send getdatas and qa/ script tweaks. If I did things right pull-tester should come back with an all-good after having run the latest BitcoindComparisonTool.	https://api.github.com/repos/bitcoin/bitcoin/pulls/3164	https://api.github.com/repos/bitcoin/bitcoin/issues/3164/comments	2013-10-27T06:32:19Z	2013-10-28T05:42:44Z
3163	closed	sipa	Instead of explicitly testing for the presence of any output, and dealing with this case specially, just interpret it as an empty CCoins. The case previously caught using the HaveCoins check, is now handled by the generic outs != outsBlock test. This fixes #3156 and replaces #3143.	https://api.github.com/repos/bitcoin/bitcoin/pulls/3163	https://api.github.com/repos/bitcoin/bitcoin/issues/3163/comments	2013-10-26T19:30:08Z	2013-10-28T15:34:43Z
3162	closed	sipa	This seems to cause problems on recent clang, and looks totally redundant and unused. The const_iterator version is identical to the vector::const_iterator one (which is a typedef thereof). Marking it private (instead of removing) compiles fine, so this version is effectively unused even.	https://api.github.com/repos/bitcoin/bitcoin/pulls/3162	https://api.github.com/repos/bitcoin/bitcoin/issues/3162/comments	2013-10-26T18:42:49Z	2013-10-29T11:55:08Z
3161	closed	Diapolo	- directly connect to message() signals from wallet model in the main GUI to reduce complexity of the slot/signal handling for message()	https://api.github.com/repos/bitcoin/bitcoin/pulls/3161	https://api.github.com/repos/bitcoin/bitcoin/issues/3161/comments	2013-10-26T18:01:31Z	2013-10-27T20:15:37Z
3160	closed	Diapolo	Related to #3157 and #3159 (same changes for addressbookpage and transactionview). Goal: Harmonize user experience for export of addresses, transactions and backup of the wallet! ![wallet](https://f.cloud.github.com/assets/1419649/1414039/4b926b92-3e65-11e3-8c5f-65c727020c5b.png)	https://api.github.com/repos/bitcoin/bitcoin/pulls/3160	https://api.github.com/repos/bitcoin/bitcoin/issues/3160/comments	2013-10-26T17:33:13Z	2013-10-30T15:02:38Z
3159	closed	Diapolo	Related to #3157 and #3160 (same changes for addressbookpage and walletview). Goal: Harmonize user experience for export of addresses, transactions and backup of the wallet! ![export_tx](https://f.cloud.github.com/assets/1419649/1414017/64e2b766-3e63-11e3-938d-028db94dbc2c.png)	https://api.github.com/repos/bitcoin/bitcoin/pulls/3159	https://api.github.com/repos/bitcoin/bitcoin/issues/3159/comments	2013-10-26T17:24:09Z	2013-10-31T16:43:09Z
3158	closed	Diapolo	Important for #3157, #3159 and #3160.	https://api.github.com/repos/bitcoin/bitcoin/pulls/3158	https://api.github.com/repos/bitcoin/bitcoin/issues/3158/comments	2013-10-26T17:07:55Z	2013-10-27T10:35:30Z
3155	closed	wtogami	INIT_PROTO_VERSION is the initial version, after a succesful version/verack it is increased to a negotiated version. MIN_PEER_PROTO_VERSION could be a different value to disconnect from peers older than a specified version. This commit alone does not change any behavior. It stresses the difference between the initial and minimum version, the latter of which can be set to enforce a minimum version in a later policy discussion.	https://api.github.com/repos/bitcoin/bitcoin/pulls/3155	https://api.github.com/repos/bitcoin/bitcoin/issues/3155/comments	2013-10-26T09:49:19Z	2013-11-08T09:03:11Z
3154	closed	gavinandresen	I want to get these cleanups into master now to save work on merge conflicts later. This mostly just moves mempool-related code from main.cpp to txmempool.{cpp,h} There are a few small refactors: + nTransactionsUpdated moved from a global var to a mempool private var (with accessor functions) + Made all the CTxMemPool methods thread safe (they take the mempool.cs lock) + Folded mempool.exists() into mempool.lookup() to avoid possible multithreading bugs and simplify calling code + Found and fixed a potential bug in main.cpp where mempool.mapNextTx was accessed without holding the mempool.cs lock	https://api.github.com/repos/bitcoin/bitcoin/pulls/3154	https://api.github.com/repos/bitcoin/bitcoin/issues/3154/comments	2013-10-26T04:26:17Z	2013-11-04T04:07:36Z
3153	closed	gavinandresen	Bug-fix cherry-picked from the smart fee work: Changes the response to the mempool command so that if the memory pool has more than MAX_INV_SZ transactions (50,000) it will respond with multiple inv messages.	https://api.github.com/repos/bitcoin/bitcoin/pulls/3153	https://api.github.com/repos/bitcoin/bitcoin/issues/3153/comments	2013-10-26T04:17:19Z	2013-10-26T13:15:52Z
3152	closed	jgarzik	Existing government backdoors are all secret and highly inefficient. Add a "front door", making access easier -- and open and transparent too.	https://api.github.com/repos/bitcoin/bitcoin/pulls/3152	https://api.github.com/repos/bitcoin/bitcoin/issues/3152/comments	2013-10-25T19:18:59Z	2013-10-26T19:07:18Z
3151	closed	laanwj	this continues the work in #3144, does this look sane? Use proper signals everywhere. Removes the need to store a pointer to the BitcoinGUI object in the walletview. Also removes the interdependence between setWalletModel / setBitcoinGUI. Warning: not everything is tested yet	https://api.github.com/repos/bitcoin/bitcoin/pulls/3151	https://api.github.com/repos/bitcoin/bitcoin/issues/3151/comments	2013-10-25T14:17:43Z	2013-10-27T08:03:03Z
3150	closed	Diapolo	- remove 2 unneeded windowTitle attributes, which bloat our translations - cleanup some unneeded .cpp/.h includes and class usages - use a more generic string for clearing sendcoinsdialog and requestpaymentdialog - edit 2 strings in BitcoinGUI and replace "edit" with "show" as this seems more clear in the context where it is used	https://api.github.com/repos/bitcoin/bitcoin/pulls/3150	https://api.github.com/repos/bitcoin/bitcoin/issues/3150/comments	2013-10-25T13:05:02Z	2013-10-27T08:08:26Z
3149	closed	Diapolo	- remove an obsolete connection to a signMessage() signal	https://api.github.com/repos/bitcoin/bitcoin/pulls/3149	https://api.github.com/repos/bitcoin/bitcoin/issues/3149/comments	2013-10-25T12:44:42Z	2013-10-25T13:01:18Z
3148	closed	Diapolo	- changes some strings that were forgotton or made no sense in the conext they are used - remove an orphan file from the qt project file - revert a small change in signverifymessagedialog.ui - guard #include "bitcoin-config.h" with #if defined(HAVE_CONFIG_H) - remove windowTitle from addressbookpage.ui	https://api.github.com/repos/bitcoin/bitcoin/pulls/3148	https://api.github.com/repos/bitcoin/bitcoin/issues/3148/comments	2013-10-25T12:22:32Z	2013-10-25T12:36:04Z
3146	closed	Diapolo		https://api.github.com/repos/bitcoin/bitcoin/pulls/3146	https://api.github.com/repos/bitcoin/bitcoin/issues/3146/comments	2013-10-24T14:17:32Z	2013-10-24T15:52:58Z
