1619	closed	mikehearn	This patch set imports the Google LevelDB 1.5 database, refactors the transaction database code a little and then lets you pick between LevelDB or BDB via a build flag (qmake USE_LEVELDB=- to go back). On test machines, LevelDB seems to be significantly faster than BDB due to the fact that the bulk of the IO work is handled by a separate thread. The main thread just appends data to the end of a log file when writing, and the IO thread then turns logs into sorted tables and compacts them together. When indexing the block chain Bitcoin appears to be CPU bound on Windows and Linux machines, even during migration when signature checking is disabled. On my SSD based MacBook Pro the performance isnt as good and it still seems to be IO bottlenecked, which is the opposite of what Id expect. This code instructs LevelDB to use a 10-bit bloom filter per block. This expands the size of the database quite a bit, but allows a reduction in disk seeks. I havent tested different bloom filter sizes to see what works better. It is an area for future work. LevelDB is statically included because: - Upstream is not widely packaged and the build system does not support "make install", so its annoying to link against - We need custom patches to make it work on Windows. - Its important that all Bitcoin users are running on a db engine tested by us. We dont want some fraction of the network nodes to be "upgraded" but still running on BDB just because of who built their binaries.	https://api.github.com/repos/bitcoin/bitcoin/pulls/1619	https://api.github.com/repos/bitcoin/bitcoin/issues/1619/comments	2012-07-21T18:47:11Z	2012-09-20T16:04:20Z
1617	closed	Diapolo	- be clear we dont "Show/Hide Bitcoins", but just the client window - remove the tooltip for toggleHideAction as this is not shown anyway	https://api.github.com/repos/bitcoin/bitcoin/pulls/1617	https://api.github.com/repos/bitcoin/bitcoin/issues/1617/comments	2012-07-21T11:05:11Z	2012-08-29T17:52:02Z
1616	closed	Diapolo	Changes only comments.	https://api.github.com/repos/bitcoin/bitcoin/pulls/1616	https://api.github.com/repos/bitcoin/bitcoin/issues/1616/comments	2012-07-21T10:47:09Z	2012-07-21T13:59:25Z
1615	closed	Diapolo		https://api.github.com/repos/bitcoin/bitcoin/pulls/1615	https://api.github.com/repos/bitcoin/bitcoin/issues/1615/comments	2012-07-20T10:21:47Z	2012-07-25T18:11:28Z
1614	closed	Diapolo	- this enables DEP on all Windows version which support the SetProcessDEPPolicy() call in Kernel32.dll - use a dynamic approach via GetProcAddress() to not rely on headers or compiler libs - this is the same way the Tor-project does it See for a detailed explanation of DEP! It is possible to enable this directly when linking, but this needs much more testing than this small patch :). I consider it a valuable 0.7 security feature on Windows. To verify if DEP is enabled for bitcoin-qt.exe you can use Sysinternals ProcessExplorer: ![verify DEP state](http://i48.tinypic.com/r8tesl.png)	https://api.github.com/repos/bitcoin/bitcoin/pulls/1614	https://api.github.com/repos/bitcoin/bitcoin/issues/1614/comments	2012-07-20T06:50:43Z	2012-08-14T04:01:18Z
1612	closed	luke-jr	- If the height is in the first half, start at the genesis block and go up, rather than at the top - Cache the last lookup and use it as a reference point if its close to the next request, to make linear lookups always fast	https://api.github.com/repos/bitcoin/bitcoin/pulls/1612	https://api.github.com/repos/bitcoin/bitcoin/issues/1612/comments	2012-07-19T20:09:42Z	2012-08-01T18:49:26Z
1611	closed	Diapolo	This replaces #1543, which needs a rebase and if this gets merged #1543 can be closed. Fixes #1062	https://api.github.com/repos/bitcoin/bitcoin/pulls/1611	https://api.github.com/repos/bitcoin/bitcoin/issues/1611/comments	2012-07-19T05:24:58Z	2012-07-19T11:36:44Z
1610	closed	fanquake	Trivial update, noticed it when I was browsing the code.	https://api.github.com/repos/bitcoin/bitcoin/pulls/1610	https://api.github.com/repos/bitcoin/bitcoin/issues/1610/comments	2012-07-18T16:04:54Z	2012-07-18T16:45:07Z
1609	closed	fanquake	No code changes. Fixed typos, updated/added a few links.	https://api.github.com/repos/bitcoin/bitcoin/pulls/1609	https://api.github.com/repos/bitcoin/bitcoin/issues/1609/comments	2012-07-18T14:18:59Z	2012-07-18T14:24:50Z
1608	closed	runeksvendsen	Update the comment in GetBlockValue() to better reflect the uncertainty about the time interval between subsidy reductions	https://api.github.com/repos/bitcoin/bitcoin/pulls/1608	https://api.github.com/repos/bitcoin/bitcoin/issues/1608/comments	2012-07-18T07:41:42Z	2012-07-18T13:13:54Z
1607	closed	Diapolo	- extend bitcoin-qt.rc to include meta information, which is displayed on Windows, when looking in the executable properties and selecting "Details" - does currently NOT include version information, this is scheduled for later releases - for RC-file documentation see: ![bitcoin-qt.exe meta information](http://i46.tinypic.com/znk095.png)	https://api.github.com/repos/bitcoin/bitcoin/pulls/1607	https://api.github.com/repos/bitcoin/bitcoin/issues/1607/comments	2012-07-18T05:37:11Z	2012-08-17T15:55:54Z
1606	closed	gavinandresen	I wanted this to create a transaction on testnet that exercised all of the SIGHASH_ modes (see txid 8ccc87b72d766ab3128f03176bb1c98293f2d1f85ebfaf07b82cc81ea6891fa9 on testnet3) It adds a fourth optional string argument to signrawtransaction, which can be ALL / NONE / SINGLE / ALL|ANYONECANPAY / etc. It just converts the string to one of the enum SIGHASH_ constants and then uses that signing mode when signing. I created that testnet transaction by: + I manually created a raw transaction with six inputs and 7 outputs + I extracted the private keys (using dumpprivkey) corresponding to the six inputs + I called signrawtransaction six times to sign each of the six inputs separately, passing in just one of the private keys and using a different SIGHASH_ mode each time. + I called sendrawtransaction to broadcast the completed transaction.	https://api.github.com/repos/bitcoin/bitcoin/pulls/1606	https://api.github.com/repos/bitcoin/bitcoin/issues/1606/comments	2012-07-17T16:14:59Z	2012-07-17T19:38:34Z
1605	closed	laanwj	Makes more sense to users, fixes #1601	https://api.github.com/repos/bitcoin/bitcoin/pulls/1605	https://api.github.com/repos/bitcoin/bitcoin/issues/1605/comments	2012-07-17T09:39:38Z	2012-07-18T06:00:23Z
1604	closed	Diapolo		https://api.github.com/repos/bitcoin/bitcoin/pulls/1604	https://api.github.com/repos/bitcoin/bitcoin/issues/1604/comments	2012-07-17T07:54:50Z	2012-07-17T09:05:30Z
1598	closed	Diapolo		https://api.github.com/repos/bitcoin/bitcoin/pulls/1598	https://api.github.com/repos/bitcoin/bitcoin/issues/1598/comments	2012-07-14T11:18:26Z	2012-07-16T18:07:41Z
1597	closed	maaku	...on any platform using Oracle VirtualBox. A minimum number of host dependencies are required. The gitian build process produces deterministic builds and living documentation of the build process. However gitian only runs within a Linux host environment, and has proven somewhat tricky to setup and maintain. The purpose of this pull-request is to provide a platform-independent set of scripts for creating a gitian build environment and launching builds for all platforms using Oracle VirtualBox, Vagrant (for recording configurations of VirtualBox; see and gitian LXC containers. See contrib/vagrant/README.md for details.	https://api.github.com/repos/bitcoin/bitcoin/pulls/1597	https://api.github.com/repos/bitcoin/bitcoin/issues/1597/comments	2012-07-13T18:16:49Z	2013-01-14T19:51:44Z
1596	closed	fanquake	1.0.0d -> 1.0.1b	https://api.github.com/repos/bitcoin/bitcoin/pulls/1596	https://api.github.com/repos/bitcoin/bitcoin/issues/1596/comments	2012-07-13T16:24:54Z	2012-07-18T00:33:26Z
1595	closed	fanquake		https://api.github.com/repos/bitcoin/bitcoin/pulls/1595	https://api.github.com/repos/bitcoin/bitcoin/issues/1595/comments	2012-07-13T14:25:56Z	2012-07-13T14:49:29Z
1594	closed	Diapolo	- re-work code parts that check if we have a Statusbar warning - use same variable names in the header	https://api.github.com/repos/bitcoin/bitcoin/pulls/1594	https://api.github.com/repos/bitcoin/bitcoin/issues/1594/comments	2012-07-13T07:04:23Z	2012-07-27T12:54:19Z
1593	closed	Diapolo	- add a comment	https://api.github.com/repos/bitcoin/bitcoin/pulls/1593	https://api.github.com/repos/bitcoin/bitcoin/issues/1593/comments	2012-07-13T06:49:04Z	2012-07-14T09:06:52Z
1592	closed	Diapolo	- this helps user to not think our Client is called "Bitcoin Wallet" - change "About Bitcoin-Qt" to "About Bitcoin" - change "Bitcoin debug window" to "Bitcoin - Debug window" - change "Client" in debug Window to "Bitcoin Core"	https://api.github.com/repos/bitcoin/bitcoin/pulls/1592	https://api.github.com/repos/bitcoin/bitcoin/issues/1592/comments	2012-07-13T06:32:13Z	2012-07-14T09:12:25Z
1591	closed	Diapolo	This will display the languages in the selection as "native language - native country (locale name)", when using Qt >= 4.8 and as such fixes #1509.	https://api.github.com/repos/bitcoin/bitcoin/pulls/1591	https://api.github.com/repos/bitcoin/bitcoin/issues/1591/comments	2012-07-13T06:01:26Z	2012-07-17T06:19:25Z
1590	closed	gavinandresen	Modify CreateNewBlock so that instead of processing all transactions in priority order, process the first 27K of transactions in priority order and then process the rest in fee-per-kilobyte order. This is the first, minimal step towards better a better fee-handling system for both miners and end-users; this patch should be easy to backport to the old versions of Bitcoin, and accomplishes the most important goal-- allow users to "buy their way in" to blocks using transaction fees. Four params give miners control over the transaction selection process: -blockmaxsize : maximum size of blocks created (default: 250000) -blockprioritysize : how much of the block to set aside for high-priority-maybe-free transactions (default: 27000) -blockminsize : minimum size of blocks created (default: 0) -mintxfee : transactions that pay below this many bitcoins-per-kilobyte are considered "free" (default: 0.0005) Discussion thread in the Mining forums:	https://api.github.com/repos/bitcoin/bitcoin/pulls/1590	https://api.github.com/repos/bitcoin/bitcoin/issues/1590/comments	2012-07-12T18:33:41Z	2012-07-26T19:32:42Z
1589	closed	Diapolo	- fixes #1560 Ive never worked with a LOCK() before ... so please help me learning this concept :).	https://api.github.com/repos/bitcoin/bitcoin/pulls/1589	https://api.github.com/repos/bitcoin/bitcoin/issues/1589/comments	2012-07-12T13:43:41Z	2012-07-12T20:51:49Z
1587	closed	Diapolo		https://api.github.com/repos/bitcoin/bitcoin/pulls/1587	https://api.github.com/repos/bitcoin/bitcoin/issues/1587/comments	2012-07-12T11:47:20Z	2012-07-14T09:11:00Z
1586	closed	luke-jr	DRAFT status, please help test! Trying to coordinate testing on IRC, possibly using NTP and	https://api.github.com/repos/bitcoin/bitcoin/pulls/1586	https://api.github.com/repos/bitcoin/bitcoin/issues/1586/comments	2012-07-12T00:19:46Z	2013-08-25T03:28:46Z
1585	closed	Diapolo		https://api.github.com/repos/bitcoin/bitcoin/pulls/1585	https://api.github.com/repos/bitcoin/bitcoin/issues/1585/comments	2012-07-11T20:56:24Z	2012-07-17T09:06:41Z
1584	closed	Diapolo	- add part for handling of plurals - update Transifex links - small misc changes I based this on your additions from #1582.	https://api.github.com/repos/bitcoin/bitcoin/pulls/1584	https://api.github.com/repos/bitcoin/bitcoin/issues/1584/comments	2012-07-11T20:37:31Z	2012-07-12T05:17:09Z
1582	closed	laanwj	Add more detailed instructions on how to update translation files after a strings change.	https://api.github.com/repos/bitcoin/bitcoin/pulls/1582	https://api.github.com/repos/bitcoin/bitcoin/issues/1582/comments	2012-07-11T12:13:11Z	2012-07-12T12:32:40Z
1581	closed	Diapolo	This should also be mentioned in the translation process, that we have to add these via the Qt Linguist app and mark them as translated there.	https://api.github.com/repos/bitcoin/bitcoin/pulls/1581	https://api.github.com/repos/bitcoin/bitcoin/issues/1581/comments	2012-07-11T12:11:26Z	2012-07-11T12:14:00Z
1580	closed	laanwj	Another base translation strings update, there have been some new strings for tor support etc	https://api.github.com/repos/bitcoin/bitcoin/pulls/1580	https://api.github.com/repos/bitcoin/bitcoin/issues/1580/comments	2012-07-11T11:39:13Z	2012-07-11T11:39:56Z
1577	closed	TheBlueMatt	Details: Uses a src/checkpoint_def.cpp file to store a static array of checkpoints. That file is easily generate-able using -saveblockcheckpointfile and gitian builds require the file as an input.	https://api.github.com/repos/bitcoin/bitcoin/pulls/1577	https://api.github.com/repos/bitcoin/bitcoin/issues/1577/comments	2012-07-10T19:58:40Z	2012-07-18T00:58:49Z
1575	closed	laanwj	Fixes #1452. Until we can make the logic water-tight *and* are notified in every case the balance might have changed (either due to blocks maturing, or outputs spent), remove the premature optimization and simply recompute the balance every half a second when the number of blocks changed. Shouldnt make any impact on performance in practice.	https://api.github.com/repos/bitcoin/bitcoin/pulls/1575	https://api.github.com/repos/bitcoin/bitcoin/issues/1575/comments	2012-07-10T13:31:35Z	2012-07-13T11:52:40Z
1574	closed	Diapolo	- as the "||" operator is not known to qmake use "|" instead, which ensures the code in brackets does never get executed on Windows	https://api.github.com/repos/bitcoin/bitcoin/pulls/1574	https://api.github.com/repos/bitcoin/bitcoin/issues/1574/comments	2012-07-10T11:49:36Z	2012-07-11T11:52:23Z
1572	closed	Diapolo	- cleanup optionsmodel before adding new proxy options - place SOCKS version stuff below proxy port (IP, Port, SOCKS version) - simplyfy some parts of the code (e.g. dont check IP and port, as this is done in optionsdialog anyway, remove unneeded {} in switch/case) - small comsetic changed in the header for better readability This is what I intend to do with the proxy options (not included here): ![planned proxy options](http://i45.tinypic.com/5a5ef9.png)	https://api.github.com/repos/bitcoin/bitcoin/pulls/1572	https://api.github.com/repos/bitcoin/bitcoin/issues/1572/comments	2012-07-09T11:46:32Z	2012-07-12T14:17:08Z
1571	closed	Diapolo	This pull is intended to prepare the optionsdialog for further changes to the proxy options and includes a few changes that would bloat a proxy options pull. - remove duplicate includes, that are already present in ui_optionsdialog.h - change QIntValidator to not allow 0 as port-number - re-order some function calls to match the Ui element order, for better readbility and to prepare for the addition of further IPv6 and Tor proxy options - restat warning for the language selection is only shown, when the language was changed (not on simply activating the Ui element) - modify proxy warning message "This setting..." into "Proxy settings..." - split check for object == ui->proxyIp into seperate if-clause - unify used format for comments in the code - introduce handleProxyIpValid() function, which handles UI elements and the save button states for valid/invalid proxy IPs This is what I intend to do with the proxy options (not included here): ![planned proxy options](http://i45.tinypic.com/5a5ef9.png)	https://api.github.com/repos/bitcoin/bitcoin/pulls/1571	https://api.github.com/repos/bitcoin/bitcoin/issues/1571/comments	2012-07-09T09:38:51Z	2012-07-27T11:08:04Z
1569	closed	Diapolo	- add signals signMessage() and verifyMessage() in addressbookpage.cpp - connect to them in bitcoingui.cpp to switch to the corresponding tab in the Sign/Verify Message dialog - make gotoSignMessageTab() and gotoVerifyMessageTab() private slots	https://api.github.com/repos/bitcoin/bitcoin/pulls/1569	https://api.github.com/repos/bitcoin/bitcoin/issues/1569/comments	2012-07-08T16:53:42Z	2012-07-10T12:38:31Z
1567	closed	sipa	SerializeHash used to create a memory-backed CDataStream, serialize the object (almost always a CTransaction) to it, and then feed it to SHA256. As most of the time is actually spent in allocating/deallocating the buffer, it is better to do the SHA256 in-place. That is what CHashWriter does. On my system, in ultraprune running on a tmpfs-backed datadir, this alone reduces total CPU time spent during import of 185k blocks by 4-5%.	https://api.github.com/repos/bitcoin/bitcoin/pulls/1567	https://api.github.com/repos/bitcoin/bitcoin/issues/1567/comments	2012-07-07T21:12:34Z	2012-07-13T12:40:43Z
1566	closed	Diapolo		https://api.github.com/repos/bitcoin/bitcoin/pulls/1566	https://api.github.com/repos/bitcoin/bitcoin/issues/1566/comments	2012-07-07T14:36:10Z	2012-07-07T14:41:51Z
1565	closed	jrmithdobbs	This fixes compatibility with opensshs socks5 proxy and tors .2.3.x branch.	https://api.github.com/repos/bitcoin/bitcoin/pulls/1565	https://api.github.com/repos/bitcoin/bitcoin/issues/1565/comments	2012-07-07T14:18:04Z	2012-07-07T14:19:54Z
1564	closed	Diapolo	- add IMPLEMENT_RANDOMIZE_STACK for ipcThread() - log / print boost interprocess exceptions - use MAX_URI_LENGTH in guiconstants.h (also used in qrcodedialog.cpp) - remove unneeded includes and ipcShutdown() from qtipcserver.cpp - fix a small mem-leak by deleting mq before re-using it - make ipcThread() and ipcThread2() static functions - add some more comments This is intended to improve some parts of our current IPC code, mostly security wise, it does not change the URI handling behaviour. I compiled this on Windows and made some tests with Bitcoin-Qt, everything okay.	https://api.github.com/repos/bitcoin/bitcoin/pulls/1564	https://api.github.com/repos/bitcoin/bitcoin/issues/1564/comments	2012-07-06T12:03:01Z	2012-07-17T07:54:12Z
1563	closed	Diapolo	- add -s flag as we also use a static build in makefile.mingw As we now use Boost 1.49 on Windows I think this should be updated as well.	https://api.github.com/repos/bitcoin/bitcoin/pulls/1563	https://api.github.com/repos/bitcoin/bitcoin/issues/1563/comments	2012-07-06T09:16:27Z	2012-07-18T09:31:40Z
1562	closed	TheBlueMatt	Please dont close this, it gives an example for jenkins to test that (obviously) doesnt build. Ill close it in a day or two when jenkins is working.	https://api.github.com/repos/bitcoin/bitcoin/pulls/1562	https://api.github.com/repos/bitcoin/bitcoin/issues/1562/comments	2012-07-05T21:37:02Z	2012-07-06T20:42:29Z
1559	closed	sje397	when these are non-zero. Fixed a minor mem leak. Relates to #837 and #1475.	https://api.github.com/repos/bitcoin/bitcoin/pulls/1559	https://api.github.com/repos/bitcoin/bitcoin/issues/1559/comments	2012-07-05T16:10:12Z	2012-07-07T11:37:03Z
1557	closed	TheBlueMatt	This is based on #1514 and adds fixes to bitcoin-qt.pro to build with clang+lto without editing makefiles. After this, you can use: qmake bitcoin-qt.pro USE_CLANG=1 USE_LTO=1 && make or make -f makefile.unix CXX=clang++ LDFLAGS="-use-gold-plugin" CXXFLAGS=-emit-llvm Building bitcoind requires ld-gold, however bitcoin-qt does not. Motivation here is a speedup: clang-lto: " block index 6523ms" gcc-lto: " block index 8497ms" That said, \<gmaxwell\> Seriously, every time Ive seen a major speedup with clang it was miscompiling the code. Still its interesting that there is a speedup that large, and making it easier to compile using clang is not bad.	https://api.github.com/repos/bitcoin/bitcoin/pulls/1557	https://api.github.com/repos/bitcoin/bitcoin/issues/1557/comments	2012-07-04T19:46:51Z	2012-07-04T20:27:14Z
1555	closed	TheBlueMatt	(aside from some boost::thread ones on win32) Fixes: src/net.h: In member function void CNode::EndMessage(): src/net.h:374: warning: invalid access to non-static data member CMessageHeader::nMessageSize of NULL object src/net.h:374: warning: (perhaps the offsetof macro was used incorrectly) src/net.h:380: warning: invalid access to non-static data member CMessageHeader::nChecksum of NULL object src/net.h:380: warning: (perhaps the offsetof macro was used incorrectly) src/net.h:381: warning: invalid access to non-static data member CMessageHeader::nChecksum of NULL object src/net.h:381: warning: (perhaps the offsetof macro was used incorrectly) Or, put better by clang++: src/net.h:377:46: warning: offset of on non-POD type CMessageHeader [-Winvalid-offsetof]	https://api.github.com/repos/bitcoin/bitcoin/pulls/1555	https://api.github.com/repos/bitcoin/bitcoin/issues/1555/comments	2012-07-04T14:40:46Z	2012-07-04T15:34:11Z
1554	closed	jgarzik	Pull request #1486 contains a bunch of BlueMatt commits in a stack. Pulled out this one out of the stack, and rebased it on top of current HEAD.	https://api.github.com/repos/bitcoin/bitcoin/pulls/1554	https://api.github.com/repos/bitcoin/bitcoin/issues/1554/comments	2012-07-04T04:11:44Z	2012-07-05T17:06:55Z
1553	closed	TheBlueMatt	Look for -MD at This just explicitly sets the output of -MMD using -MF to the default of where the output would otherwise have gone.	https://api.github.com/repos/bitcoin/bitcoin/pulls/1553	https://api.github.com/repos/bitcoin/bitcoin/issues/1553/comments	2012-07-03T15:31:26Z	2012-07-04T14:51:51Z
1552	closed	Diapolo	- remove "#include <QString>" as this is included in the header - add some missing plural forms that can be translated - change "yours" into "own address", which is easier to understand and translate in that context - cleanup translatable strings to not include HTML or unneeded chars (e.g. ":") - resize TransactionDescDialog a little (remove unwanted line-breaks with non english translations)	https://api.github.com/repos/bitcoin/bitcoin/pulls/1552	https://api.github.com/repos/bitcoin/bitcoin/issues/1552/comments	2012-07-03T12:40:51Z	2012-07-07T11:44:50Z
1551	closed	TheBlueMatt	This adds SHARED_LOCK, TRY_SHARED_LOCK, and UPGRADE_LOCK to complement LOCK and TRY_LOCK. It implements the many-readers, single-writer model where any thread holding a LOCK excludes other threads from a SHARED_LOCK, but many threads can hold a SHARED_LOCK. Only one thread can hold a UPGRADE_LOCK, it can be held while others hold a SHARED_LOCK, but it cannot be held while another thread holds a LOCK. This should create tons of low-hanging fruit for optimization, even though it doesnt do any itself.	https://api.github.com/repos/bitcoin/bitcoin/pulls/1551	https://api.github.com/repos/bitcoin/bitcoin/issues/1551/comments	2012-07-03T02:52:35Z	2012-09-05T01:42:29Z
1549	closed	TheBlueMatt	Useful Changes: * Moves the DNS lookup of -addnode nodes into the repeated loop, allowing -addnode to follow DNS changes. * Try more than the first address for a DNS -addnode. Two new RPC commands: * addnode <node>. Adds <node> the same as if -addnode were used. Note that it can take up to two minutes before the addnode thread runs again and connects to the new node. * getaddednodeinfo [node]. Gets the list of added nodes including whether they are connected and to which node they are connected. Or gets the list of connections to [node] given [node] is specified in the same way as with -addnode/addnode. eg: getaddednodeinfo dnsseed.bluematt.me [ { "addednode" : "dnsseed.bluematt.me", "connectedto" : [ "95.154.99.150:8333", "80.221.217.69:8333" ] } ] or getaddednodeinfo [ { "addednode" : "10.232.4.10", "connectedto" : [ "10.232.4.10:8333" ] }, { "addednode" : "dnsseed.bluematt.me", "connectedto" : [ "95.154.99.150:8333", "80.221.217.69:8333" ] } ]	https://api.github.com/repos/bitcoin/bitcoin/pulls/1549	https://api.github.com/repos/bitcoin/bitcoin/issues/1549/comments	2012-07-02T19:19:53Z	2013-01-28T19:09:04Z
1548	closed	TheBlueMatt	In the most obvious way possible.	https://api.github.com/repos/bitcoin/bitcoin/pulls/1548	https://api.github.com/repos/bitcoin/bitcoin/issues/1548/comments	2012-07-02T14:31:04Z	2012-07-04T02:50:07Z
1546	closed	gmaxwell	Bitcoin will not make an outbound connection to a network group (/16 for IPv4) that it is already connected to. This means that if an attacker wants good odds of capturing all a nodes outbound connections he must have hosts on a a large number of distinct groups. Previously both inbound and outbound connections were used to feed this exclusion. The use of inbound connections, which can be controlled by the attacker, actually has the potential of making sibyl attacks _easier_: An attacker can start up hosts in groups which house many honest nodes and make outbound connections to the victim to exclude big swaths of honest nodes. Because the attacker chooses to make the outbound connection he can always beat out honest nodes for the consumption of inbound slots. At _best_ the old behavior increases attacker costs by a single group (e.g. one distinct group to use to fill up all your inbound slots), but at worst it allows the attacker to select whole networks you wont connect to. This commit makes the nodes use only outbound links to exclude network groups for outbound connections. Fancier things could be done, like weaker exclusion for inbound groups... but simplicity is good and I dont believe more complexity is currently needed.	https://api.github.com/repos/bitcoin/bitcoin/pulls/1546	https://api.github.com/repos/bitcoin/bitcoin/issues/1546/comments	2012-07-02T00:45:06Z	2012-07-04T02:51:08Z
1545	closed	TheBlueMatt	* fix #1544 * Change send buffer default to 1M, as the send buffer is more often maxed now.	https://api.github.com/repos/bitcoin/bitcoin/pulls/1545	https://api.github.com/repos/bitcoin/bitcoin/issues/1545/comments	2012-07-01T02:18:58Z	2012-07-02T01:17:35Z
